event_name,description,audience,cycle,website,email,country,date_uncertain,date,duration_days,venue_id
FAYETTEVILLE GUN & KNIFE SHOW 2024,"Arms and Ammunition Fair. FAYETTEVILLE SUMMER GUN & KNIFE SHOW showcases shooting rifles, all sizes of knives, samurai swords, shotguns, collectible firearms, hunting and fishing accessories, Militaria of All Wars, ammo, carbines, cartridges and holsters",Public,unknown,http://www.cegunshows.com/fayetteville-gun-show.html,info@showmastersgunshows.com,USA,False,2024-02-03,2,856
CONNECTICUT WEDDING & BRIDAL EXPO 2024,"Bridal expo show in Connecticut. Wedding dresses, bridesmaid dresses, invitations, shoes, venues and literally all other bridal and wedding services imaginable",Public,once a year,http://www.jenksproductions.com/event/connecticut-bridal-expo,monica@jenksproductions.com,USA,False,2024-02-03,2,534
WEST MICHIGAN GOLF SHOW 2024,West Michigan Golf Show,Public,once a year,http://showspan.com/download/misc/ShowSpanSchedule.pdf,events@showspan.com,USA,False,2024-02-09,3,615
EXPO HABITATION DE MONTRÉAL 2024,"Construction and Renovation Expo. Montréal Home Expo braings together all you need to buy, build, renovate or decorate a house or a condo in the Greater Montreal area, Quebec’s #1 residential housing market",Public,once a year,http://expohabitation.ca/en,info@expomediainc.com,Canada,False,2024-02-08,4,857
THE GREAT BIG HOME + GARDEN SHOW 2024,"Cleveland, OH Home & Garden Expo. Innovative Products and Hundreds of Experts all Under One Roof",Public,once a year,http://www.greatbighomeandgarden.com/,rosannah@marketplaceevents.com,USA,False,2024-02-02,10,616
THE FRANCHISE EXPO - WINNIPEG 2024,North America's Franchise & Business Opportunities Event. THE FRANCHISE EXPO showcases the fastest growing franchises & business opportunities with thousands of potential franchisees & business partners eager ready to invest,Public,once a year,http://www.franchiseshowinfo.com/winnipeg-visitor,info@nationalevent.com,Canada,False,2024-02-03,2,774
ATX WEST 2024,"ATX West is where these brands meet to connect and showcase industrial machinery, AI, and robotics, and maintenance advancements to provide premier automation solutions for your company",Public,once a year,http://www.imengineeringwest.com/en/show-brands/atx-west.html,registration.ime@informa.com,USA,False,2024-02-06,3,803
BRIDAL SHOWCASE - MOUNTAIN AMERICA EXPO CENTER 2024,Wedding Fair,Public,once a year,http://greenband.com/bridal,showinfo@greenband.com,USA,False,2024-02-10,1,446
FXBG KID FEST 2024,"From toys to trains, face painting to fire fighters- it's FXBG KID FEST!",Public,once a year,http://www.fredericksburgexpocenter.com/,events@fred-center.com,USA,False,2024-02-10,2,688
MINNEAPOLIS HOME + REMODELING SHOW 2024,"Minneapolis, MN Home, Gardening, Remodelling and Home Decor show",Public,once a year,http://minneapolishomeandremodelingshow.com/,rosannah@marketplaceevents.com,USA,False,2024-02-02,3,858
MONTREAL HOMEEXPO 2024,Montréal Home & Interior Design Show. Innovative Products and Hundreds of Experts all Under One Roof,Public,once a year,http://expohabitation.ca/,jessicab@marketplaceevents.com,Canada,False,2024-02-08,4,857
WORCESTER WEDDING & BRIDAL EXPO 2024,"Bridal expo show in New England. Wedding dresses, bridesmaid dresses, invitations, shoes, venues and literally all other bridal and wedding services imaginable",Public,once a year,http://www.jenksproductions.com/event/worcester-bridal-expo,monica@jenksproductions.com,USA,False,2024-02-03,2,534
THE NAUGHTY BUT NICE SHOW - VANCOUVER 2024,"The Taboo Naughty but Nice Sex Show provides an upscale adult playground dedicated to enhancing lifestyles, encouraging romance, personal betterment and all things Taboo",Public,once a year,http://tabooshow.com/vancouver,tickets@canwestproductions.com,Canada,False,2024-02-02,3,790
BUILDEX VANCOUVER 2024,"Event dedicated to Property Managers, Building Owners, Facility Managers and Operations Manager. Buildex Vancouver features Interior design and architecture, Property and real estate management, Construction and Renovation",Public,once a year,http://www.buildexvancouver.com/,propertymanager@themart.com,Canada,False,2024-02-14,2,790
ACCESS MBA - MONTREAL 2024,ACCESS MBA is a communication campaign specifically designed to better inform prospective students of existing MBA opportunities. ACCESS MBA is a series of events organised around the world,Public,twice a year,http://www.accessmba.com/tour,coutat@advent-communication.net,Canada,False,2024-02-12,1,859
SILICON VALLEY INTERNATIONAL AUTO SHOW 2024,"International Auto Showin in San Jose. SILICON VALLEY INTERNATIONAL AUTO SHOW will present a wide selection of manufacturer's new-model vehicles, trucks, SUVS & collection of high-end exotic vehicles from Maserati, Bentley and Rolls-Royce",Public,once a year,http://www.svautoshow.com/,steve@svautoshow.com,USA,False,2024-02-16,3,591
KC REMODEL + GARDEN SHOW 2024,"The KC Remodel + Garden Show is the largest show in the region (over 500 exhibitors), featuring home and garden products",Public,once a year,http://kcremodelandgarden.com/,rosannah@marketplaceevents.com,USA,False,2024-02-16,3,860
SPAR 3D EXPO & CONFERENCE 2024,"Trade show & Conference devoted to 3D sensing, 3D processing and 3D visualization tools",Public,once a year,http://www.spar3d.com/event,shiggins@divcom.com,USA,False,2024-02-11,3,532
CINCINNATI-DAYTON RV SUPER SHOW 2024,"Recreational Vehicles Show in Ohio. CINCINNATI-DAYTON RV SUPER SHOW features camping car, travel trailers, SUV, Tow vehicle, automobile parts, car accessories, tool, all travel & recreational vehicles",Public,once a year,http://www.gsevents.com/rv-shows.cfm,vilma.fraguada@goodsam.com,USA,False,2024-02-16,3,861
CATERSOURCE CONFERENCE & TRADESHOW 2024,"Expo & Conference for owners, executive chefs and managers, food and beverage directors, culinary and sales staff",Public,once a year,http://www.catersource.com/conference-tradeshow,info@catersource.com,USA,False,2024-02-12,4,746
CHARLOTTE HOME + REMODELING SHOW 2024,"Charlotte, NC Home Show. Innovative Products and Hundreds of Experts all Under One Roof",Public,once a year,http://charlottehomeandremodelingshow.com/,rosannah@marketplaceevents.com,USA,False,2024-02-23,3,566
ASCEND 2024,"ASCEND is a new event designed to accelerate space commerce, exploration, and new discovery",Public,once a year,http://www.aiaa.org/events-learning/Forums,chriss@aiaa.org,USA,False,2024-10-28,3,807
HOME IMPROVEMENT & DESIGN EXPO - ELK RIVER 2024,"Home Improvement & Design Show. Home Improvement & Design Expo ELK RIVER will enable you to meet decorators, builders, remodelers, designers, suppliers and other professionals with expertise in the home improvement and design industry",Public,once a year,http://minnesotahomeshows.com/show-schedule,contact@minnesotahomeshows.com,USA,False,2024-02-10,1,862
NORTHWEST FLOWER & GARDEN FESTIVAL 2024,"Seattle, WA Flower & Garden Show",Public,once a year,http://www.gardenshow.com/,JeffS@mpeshows.com,USA,False,2024-02-14,5,863
AAOS ANNUAL MEETING 2024,AAOS (American Academy of Orthopedic Surgeons) Annual Meeting,Public,once a year,http://www.aaos.org/annual,meeting@aaos.org,USA,False,2024-02-12,5,510
OFF PRICE LAS VEGAS 2024,"A leading B2B trade show, featuring quality merchandise in the latest styles & trends, at low pricing. Apparel, Footwear, & Accessories in all categories for men, women, & children - attracting retailers from major retail chains, small boutique owners...",Public,once a year,http://www.offpriceshow.com/lasvegas,info@tarsus.co.uk,USA,False,2024-02-13,4,864
"DULUTH BOAT, SPORTS, TRAVEL & RV 2024","Boat, Sports, Travel & RV Show",Public,once a year,http://www.shamrockprod.com/visitor/duluth/duluthvhome.aspx,,USA,False,2024-02-15,4,710
VINTAGE TULSA SHOW 2024,"Premiere Antique Sale in Oklahoma. VINTAGE TUSLA SHOW features collectibles, antique toys, vintage art & pottery, fist editions, Architectural Salvage, antique jewelry, rare glassware & antique furniture",Public,once a year,http://www.heritageeventcompany.com/,heritageeventco@gmail.com,USA,False,2024-02-16,3,567
BIRMINGHAM HOME SHOW 2024,"Birmingham, AL Home & Garden Show. Innovative Products and Hundreds of Experts all Under One Roof",Public,once a year,http://birminghamhomeshow.com/,rosannah@marketplaceevents.com,USA,False,2024-02-16,3,865
THE UTAH RV SHOW 2024,"Utah Sportsmen, Vacation & RV Show",Public,once a year,http://greenband.com/#rv,showinfo@greenband.com,USA,False,2024-02-15,4,446
KNOXVILLE RV SUPER SHOW 2024,"Recreational Vehicles Show in Tennessee. KNOXVILLE RV SUPER SHOW features camping car, travel trailers, SUV, Tow vehicle, automobile parts, car accessories, tool, all travel & recreational vehicles",Public,once a year,http://www.rvsupershows.com/copy-of-nashville-1,vilma.fraguada@goodsam.com,USA,False,2024-02-10,2,698
CANADIAN CONCRETE EXPO 2024,"Canada's only National Trade Show dedicated to the Concrete, Aggregates, and Construction Industries",Public,once a year,http://canadianconcreteexpo.com/,sue@exposition.com,Canada,False,2024-02-14,2,585
GLOBE FORUM 2024,"Biennially, thousands of environmental business leaders and sustainability practitioners come in Vancouver to explore the mutually inclusive goals of corporate sustainability, business growth, energy solutions, responsible investment and urban development",Public,every 2 years,http://www.globeseries.com/,info@globe2010.ca,Canada,False,2024-02-13,3,790
PALM BEACH JEWELRY & ANTIQUE SHOW 2024,"Jewelry & Antique Show in Palm Beach. Palm Beach Jewelry & Antique Show features the collections of renowned international dealers, attracts tens of thousands of private collectors, museum curators, investors and interior designers",Public,once a year,http://www.palmbeachshow.com/,Info@palmbeachshowgroup.com,USA,False,2024-02-15,6,715
"FORD INDIANAPOLIS BOAT, SPORT, AND TRAVEL SHOW 2024","Travel Industry, Sports and Boat Show",Public,once a year,http://www.indianapolisboatsportandtravelshow.com/,info@renfroproductions.com,USA,False,2024-02-16,10,587
DISCOVER BOATING MIAMI INTERNATIONAL BOAT SHOW 2024,"As the largest boat and yacht event in the world, ""Discover Boating Miami International Boat Show"" welcomed over 100, 000 visitors and featured more than a thousand of highly sought-after boating and marine products",Public,once a year,http://www.miamiboatshow.com/en/home.html,webmaster@nmma.org,USA,False,2024-02-14,5,770
NEW ENGLAND HOME SHOW - LINCOLN 2024,"Lincoln, RI Home Show",Public,once a year,http://www.newenglandhomeshows.com/home-show-lincoln,info@newenglandhomeshows.com,USA,False,2024-02-16,3,866
DOWNTOWN RALEIGH HOME SHOW 2024,"Raleigh, NC Home Show. Innovative Products and Hundreds of Experts all Under One Roof",Public,once a year,http://raleighspringshow.com/,rosannah@marketplaceevents.com,USA,False,2024-02-16,3,867
NEW JERSEY BOAT SALE & EXPO 2024,"The New Jersey Boat Sale & Expo and the Jersey Shore Boat Sale & Expo are dedicated to promoting, protecting and advancing the recreational marine industry and waterways in the State of New Jersey",Public,once a year,http://www.jerseyboatexpo.com/new-jersey-boat-sale-and-expo,info@mtanj.org,USA,False,2024-02-15,4,762
PROGRESSIVE INSURANCE MIAMI INTERNATIONAL BOAT SHOW 2024,Miami International Boat Show,Public,once a year,http://www.miamiboatshow.com/,terry@scma.com,USA,False,2024-02-14,5,770
CASTLE ROCK GUN SHOW 2024,"Colorado's Largest Gun Show. Every Tanner Gun Show is buy, sell, and trade",Public,once a year,http://www.tannergunshow.com/,TannerGunShow@gmail.com,USA,False,2024-02-16,3,868
NORTHLAND OUTDOORS DULUTH DEER CLASSIC 2024,Outdoor Trade Fair,Public,once a year,http://www.shamrockprod.com/visitor/deer/deervhome.aspx,,USA,False,2024-02-15,4,710
PLAYTIME NEW YORK 2024,International trade show dedicated to the children’s universe and maternity wear. Playtime NY showcases various artwork related to the world of children,Public,twice a year,http://www.iloveplaytime.com/fr/events/newyork,chantal@iloveplaytime.com,USA,False,2024-02-11,3,869
POLYETHYLENE FILMS NORTH AMERICA 2024,Congress dedicated to Polyethylene Films. Connecting industry professionals to explore the latest technical developments and trends,Public,once a year,http://www.ami.international/events/upcoming,info@amiplastics.com,USA,False,2024-02-12,3,840
RALEIGH FALL HOME SHOW 2024,"Raleigh Home Show. Find fresh inspiration, helpful tips, innovative products and fantastic deals in remodelling, home improvement, decor & outdoor spaces with hundreds of experts all under one roof. From windows and flooring to cabinets & patios...",Public,once a year,http://www.raleighfallshow.com/,rosannah@marketplaceevents.com,USA,False,2024-02-16,3,867
PACIFIC NORTHWEST SPORTSMEN'S SHOW 2024,"Outdoor Trade Fair. Pacific Northwest Sportsmen’s Show showcases top-notch fishing, hunting & camping gear, guides & outfitters, taxidermy, information on lodges & resorts, boats, campers & tent trailers, ATV’s, backpacking, optics, outdoor clothing",Public,once a year,http://www.thesportshows.com/shows/pacific-northwest,info@otshows.com,USA,False,2024-02-14,5,743
ACCESS MBA - VANCOUVER 2024,ACCESS MBA is a communication campaign specifically designed to better inform prospective students of existing MBA opportunities. ACCESS MBA is a series of events organised around the world,Public,twice a year,http://www.accessmba.com/tour,coutat@advent-communication.net,Canada,False,2024-02-15,1,659
WOMENS WEAR IN NEVADA 2024,"This show offers womenswear buyers a full selection of traditional, contemporary, missy, petite, tall, plus size and endless accessories",Public,twice a year,http://www.wwinshow.com/,info@clarionevents.com,USA,False,2024-02-13,3,429
KIDS EXPO FREDERICKSBURG 2024,"Kids expo focusing on local summer camps, day cares, children's clothing, toys, sports leagues",Public,once a year,http://www.fredericksburgexpocenter.com/fxbgevents,bmcloughlin@bmg1.com,USA,False,2024-02-10,2,688
ART WYNWOOD 2024,"Contemporary and Modern art fair in Miami. ART WYNWOOD features fine arts, emergent modern artwork, paintings, sculptures, design on fabrics, woodwork, photography, drawings, video art, curio and antiques",Public,once a year,http://www.artwynwood.com/,info@artwynwood.com,USA,False,2024-02-14,5,870
ACCESS MBA - TORONTO 2024,ACCESS MBA is a communication campaign specifically designed to better inform prospective students of existing MBA opportunities. ACCESS MBA is a series of events organised around the world,Public,twice a year,http://www.accessmba.com/tour,coutat@advent-communication.net,Canada,False,2024-02-13,1,730
PROJECT LAS VEGAS 2024,"PROJECT connects fashion + culture, so you can discover trends, access opportunity, exchange ideas, and create connections. Bringing together the best in men's and women's contemporary apparel, footwear, and accessories",Public,twice a year,http://www.magicfashionevents.com/lv/en/home.html,cs@fashionresource.com,USA,False,2024-02-13,3,429
BIG SPRING HOME & GARDEN SHOW 2024,"Home improvements and remodeling show in Pomona, C. POMONA BIG SPRING HOME & GARDEN SHOW features furniture, kitchen appliances, bathroom designs, construction & renovation services, re-modeling ideas, interior designers...",Public,once a year,http://www.homeshowconsultants.com/,showofficehsc@gmail.com,USA,False,2024-02-16,3,686
WORLD AG EXPO '2024,"International Farming Expo. WORLD AG EXPO ia a showcase of Products, Technology and Equipment for the Farm, Dairy, Ranch, Construction and the farming industry in gerneral",Public,once a year,http://www.worldagexpo.com/,info@farmshow.org,USA,False,2024-02-13,3,871
MAGIC LAS VEGAS 2024,"MAGIC is a high energy &#8239; fashion experience and home to the largest selection of trend-driven &#8239; and young&#8239; contemporary &#8239; apparel, footwear, and accessories in the industry.&#8239;&#8239;",Public,twice a year,http://www.magicfashionevents.com/,cs@fashionresource.com,USA,False,2024-02-13,3,429
CATERSOURCE 2024,"Catersource will help you learn trends and techniques used by successful chefs throughout the industry. For chefs, cooks, owners and just about anyone who wants to make cuisine the main event...",Public,once a year,http://conference.catersource.com/,info@catersource.com,USA,False,2024-02-12,4,746
RE+ NORTHEAST 2024,RE+ Northeast attracts energy professionals from across the solar and storage markets each year to facilitate business and connections,Public,once a year,http://re-plus.events/northeast,customerservice@re-plus.com,USA,False,2024-02-13,2,764
GRAND RAPIDS BOAT SHOW 2024,Grand Rapids Boat Show,Public,once a year,http://showspan.com/GRB,events@showspan.com,USA,False,2024-02-14,5,615
SOUTHERN CONNECTICUT HOME & GARDEN SHOW 2024,"Southern Connecticut Home & Garden Show. If you’re planning on remodeling or renovating your home, this is the home improvement event you can’t afford to miss",Public,once a year,http://www.jenksproductions.com/event/annual-southeastern-ct-home-and-garden-show,monica@jenksproductions.com,USA,False,2024-02-16,3,872
LA ART SHOW 2024,"Contemporary Art, Modern Art, Historic and Traditional Art Exhibition in Los Angeles. LA Art Show composed of The Modern & Contemporary Section, The Historic & Traditional Contemporary Section, The Vintage Poster Section & The IFPDA Los Angeles Print Fai",Public,once a year,http://www.laartshow.com/,Info@palmbeachshowgroup.com,USA,False,2024-02-14,5,626
CNY BOAT SHOW 2024,"This Show will showcase hundreds of new and second-hand model power and sail boats, including cruisers, and sport boats … all on display at the oldest and largest boat show in the state of New York",Public,once a year,http://www.cnyboatshow.com/,bia@twcny.rr.com,USA,False,2024-02-15,4,873
PALM BEACH FINE CRAFT SHOW 2024,"Fine Craft Show. The Palm Beach Fine Craft Show is a premier showcase of American contemporary art, presenting masterful work, beautifully displayed in an elegant setting",Public,once a year,http://www.palmbeachfinecraft.com/,info@craftsamericashows.com,USA,False,2024-02-16,3,715
INDIANA MOTORCYCLE EXPO 2024,The largest motorcycle & powersports expo in the Midwest,Public,once a year,http://renfroproductions.com/shows/indiana-motorcycle-expo,nfo@renfroproductions.com,USA,False,2024-02-16,3,587
INTERNATIONAL LIDAR MAPPING FORUM 2024,"International LiDAR Mapping Forum is a technical conference and exhibition showcasing the latest airborne, terrestrial and underwater LiDAR as well as emerging remote-sensing and data collection tools and technologies",Public,once a year,http://www.lidarmap.org/international,BCallahan@Divcom.com,USA,False,2024-02-11,3,532
RALEIGH SPRING HOME SHOW 2024,"Raleigh Home Show. Find fresh inspiration, helpful tips, innovative products and fantastic deals in remodelling, home improvement, decor & outdoor spaces with hundreds of experts all under one roof. From windows and flooring to cabinets & patios...",Public,once a year,http://raleighspringshow.com/,rosannah@marketplaceevents.com,USA,False,2024-02-16,3,867
CALGARY SPRING HOME & GARDEN SHOW 2024,Home and Garden Show. The Calgary Spring Home & Garden is the ultimate show on all things lifestyle. Seeking a new painting for your living room or a kitchen renovator? Designing a new home or renovating your existing space? This show is for you,Public,once a year,http://www.calgaryhgs.com/,martine@mpeshows.com,Canada,False,2024-02-22,4,452
SPRING HOME & REMODELING SHOW 2024,"Home and Garden Show. Fredericksburg Spring Home & Garden Show offers a one-stop shop for all of your redecorating, remodeling, and building needs",Public,once a year,http://www.fredericksburgexpocenter.com/,events@fred-center.com,USA,False,2024-02-23,3,688
SAVANNAH BOAT & OUTDOOR SHOW 2024,Boat Show,Public,once a year,http://savannahboatshow.com/,,USA,False,2024-02-23,3,738
GLUTEN FREE EXPO - CALGARY 2024,"Canada’s largest gluten free event. A fun, tasty, and informative event for the whole family. Sample, shop, and save on hundreds of gluten free products while learning from leading experts",Public,once a year,http://www.glutenfreeexpo.ca/,,Canada,True,2024-09-01,1,550
GREATER MILWAUKEE AUTO SHOW 2024,"International Auto Show in Milwaukee. GREATER MILWAUKEE AUTO SHOW will present a wide selection of manufacturer's new-model vehicles, trucks, SUVS & collection of high-end exotic vehicles from Maserati, Bentley and Rolls-Royce",Public,once a year,http://autoshowmilwaukee.com/,SFreeman@enthusiastnetwork.com,USA,False,2024-02-24,10,874
WORLD MAIL & EXPRESS AMERICAS 2024,World Mail & Express Conference and Exhibition,Public,once a year,http://www.triangle.eu.com/events,team@triangle.eu.com,USA,False,2024-02-18,3,875
MAGIC NEW YORK 2024,"MAGIC is a high energy fashion experience and home to the largest selection of trend-driven and young&#8239; contemporary apparel, footwear, and accessories in the industry.&#8239;&#8239;",Public,once a year,http://www.magicfashionevents.com/en/home.html,cs@fashionresource.com,USA,False,2024-02-20,3,551
NEW YORK FARM SHOW 2024,"The New York Farm Show, leading farm show in the Northeast, displays the latest in farm equipment, tractors, combines & farm implements, seed and crop protection products, farm supplies & services, dairy and beef production, woodlot...",Public,once a year,http://www.newyorkfarmshow.com/en/home.html,shows@farmprogress.com,USA,False,2024-02-22,3,873
COLUMBIA HOME & LANDSCAPE EXPO 2024,Columbia Home & Landscape Expo is a comprehensive home show that brings together homeowners and many of the most knowledgeable and experienced remodeling and building experts,Public,once a year,http://www.homeshowcenter.com/overview/columbia2,info@homeshowcenter.com,USA,False,2024-02-23,3,754
AUTOMOTIVE MEETINGS QUERETARO 2024,International Manufacturing Forum for the Automotive Industry,Public,every 2 years,http://www.mexico.automotivemeetings.com/,info@advbe.com,Mexico,False,2024-02-20,3,876
EXHIBITOR LIVE 2024,Exhibition for the Trade Show and Corporate Event Marketing Professionals,Public,once a year,http://www.exhibitoronline.com/exhibitorshow,hei-info@heiexpo.com,USA,False,2024-02-25,4,877
AMWC AMERICAS - AESTHETIC & ANTI-AGING MEDICINE WORLD CONGRESS - NEW 2024,Aesthetic & Anti-Aging Medicine World Congress,Public,once a year,http://www.amwcamericas.com/en/home.html,registration@euromedicom.com,USA,False,2024-02-22,3,707
SOURCING AT MAGIC NEW YORK 2024,"SOURCING at MAGIC New York will address everchanging sourcing needs, and will solve for supply chain challenges facing the fashion industry",Public,twice a year,http://www.sourcingatmagic.com/en/sourcing-new-york/about-sourcing-new-york.html,cs@fashionresource.com,USA,False,2024-02-20,3,551
COTERIE NEW YORK 2024,"COTERIE is elevated women’s contemporary apparel, accessories, and footwear spanning premium&#8239; to&#8239; affordable luxury&#8239; price&#8239; points",Public,twice a year,http://www.coteriefashionevents.com/ny/en/home.html,cs@fashionresource.com,USA,False,2024-02-20,3,551
"INDIANA DEER, TURKEY, & WATERFOWL EXPO 2024","Hunting fair. Find travel destinations to boating, fishing and hunting",Public,once a year,http://www.indianadeerandturkeyexpo.com/,info@renfroproductions.com,USA,False,2024-02-22,4,587
PHILLY HOME + GARDEN SHOW 2024,"Philadelphia, PA Home & Garden Show. Innovative Products and Hundreds of Experts all Under One Roof",Public,once a year,http://phillyhomeandgarden.com/,rosannah@marketplaceevents.com,USA,False,2024-02-23,3,470
GLOBAL WASTE MANAGEMENT SYMPOSIUM 2024,North America's #1 technical conference for research and case studies on waste management. Get ready to share ideas and problem solve with your peers and colleagues from around the world and experience...,Public,once a year,http://www.wastesymposium.com/en/home.html,GWMS@informa.com,USA,False,2024-02-25,4,878
WESTERN VETERINARY CONFERENCE 2024,Veterinary Conference,Public,once a year,http://exhpo.com/usa/wvc,info@wvc.org,USA,False,2024-02-18,4,620
OUTDOORAMA 2024,"Whether it's hunting, fishing, boating, canoeing, hiking, mushroom hunting or bird watching, this show has plenty to offer",Public,once a year,http://showspan.com/OUT,events@showspan.com,USA,False,2024-02-22,4,759
WORCESTER RV & CAMPING SHOW 2024,"Camping, Travel and Recreational Vehicles Fair",Public,once a year,http://www.jenksproductions.com/event/worcester-rv-and-camping-show,monica@jenksproductions.com,USA,False,2024-02-23,3,879
CONFOO.CA MONTREAL 2024,Web Technology Conference. ConFoo Montreal is a multi-technology conference for web developers,Public,once a year,http://confoo.ca/,board@confoo.ca,Canada,False,2024-02-21,3,880
OKLAHOMA CITY SPRING REMODEL & LANDSCAPE SHOW 2024,Home & Garden Show. Oklahoma City Spring Remodel and Landscape Show is a comprehensive home show that brings together homeowners and the most knowledgeable and experienced remodeling and building experts,Public,once a year,http://www.homeshowcenter.com/overview/oklahomacityhome,info@homeshowcenter.com,USA,False,2024-02-23,3,724
CONCORD GUN & KNIFE SHOW 2024,"Arms and Ammunition Fair. CONCORD FALL GUN & KNIFE SHOW features shooting rifles, handguns, shotguns, combat knives, samurai swords, cartridges, antique coins, hunting and fishing accessories, carbines, coins and defense weapons",Public,unknown,http://www.cegunshows.com/about-us.html,info@showmastersgunshows.com,USA,False,2024-02-24,2,808
GUNS & KNIFE SHOW ALBANY 2024,"Arms and Ammunition fair. GUNS & KNIFE SHOW ALBANY presents all types of firearms, training, combat knives & swords, fishing gears, antique pistols, cartridges, hunting accessories, gun cases & safes, self protection weapons and outdoor equipment",Public,unknown,http://www.gemcapitolshows.com/,tiamalle@aol.com,USA,False,2024-02-24,2,881
