event_name,description,audience,cycle,website,email,country,date_uncertain,date,duration_days,venue_id
BATESVILLE GUN SHOW 2024,"Guns & Knives show. BATESVILLE GUN SHOW presents all types of firearms, combat knives & swords, rifle spokes, laser sights, hunting gears, muzzle loading, cartridges, holsters, knife sharpening tools, self defense training at Discount Prices",Public,twice a year,http://www.bigpopgunshows.com/services,bigpopfireworks@gmail.com,USA,False,2024-04-13,2,1016
FAIRGROUNDS SOUTHERN IDEAL HOME SHOW (SPRING) 2024,"Raleigh, NC Home Show. Innovative Products and Hundreds of Experts all Under One Roof",Public,once a year,http://raleighfairgroundshomeandgardenshow.com/,rosannah@marketplaceevents.com,USA,False,2024-04-12,3,725
EQUIPOTEL 2024,"International Trade Show of Equipment, Products, Services, Food and Beverage to Hotels, Motels, Flat Services, Restaurants, Bars, Snack Bar, Fast Food Restaurants, Food Service Industry and Laundries",Public,once a year,http://www.equipotel.com.br/,comercial@equipotel.com.br,Brazil,False,2024-09-17,4,451
KISS95-7 HARTFORD BRIDAL SHOW 2024,"Bridal expo show in Connecticut. Wedding dresses, bridesmaid dresses, invitations, shoes, venues and literally all other bridal and wedding services imaginable",Public,once a year,http://www.jenksproductions.com/event/hartford-bridal-expo,monica@jenksproductions.com,USA,False,2024-04-14,1,994
VISION - INTERNATIONAL WINDOW COVERINGS EXPO (IWCE) 2024,"Hard and Soft Window Coverings, Decorative Drapery Hardware, etc. Vision IWCE is a great industry's gathering to share ideas for not only the Window Coverings Industry but Kitchen & Bath design as well",Public,once a year,http://www.facebook.com/IWCEXPO,info@wf-vision.com,USA,False,2024-04-11,2,795
ISC WEST 2024,"International Security Conference & Exposition. ISC West is the leading comprehensive & converged security trade event in the U.S. At ISC West, you will have the chance to network and connect with thousands of security & public safety professionals",Public,once a year,http://www.iscwest.com/,inquiry@isc.reedexpo.com,USA,False,2024-04-09,4,864
AMERICAN BIOMANUFACTURING SUMMIT 2024,Annual American Biopharma Engineering & Manufacturing Summit,Public,once a year,http://biomanamerica.com/,info@generisgp.com,USA,False,2024-04-10,2,1017
STAMP & SCRAPBOOK EXPO ORLANDO 2024,"Art & Craft fair in Florida, F. STAMP & SCRAPBOOK EXPO ORLANDO features craft show, craft shopping, paper craft, clay modelling, abstract arts, Art & Craft workshop, craft tools, creative ideas and crafts for kids",Public,once a year,http://www.scrapbookexpo.com/,Info@scrapbookexpo.com,USA,False,2024-04-12,2,986
AUTOMECHANIKA ARGENTINA 2024,Argentina’s leading international trade fair for the automotive service industry targeting trade visitors from South America,Public,every 2 years,http://automechanika.ar.messefrankfurt.com/buenosaires/en.html,automechanika@argentina.messefrankfurt.com,Argentina,False,2024-04-10,4,523
SOLARPLAZA SUMMIT ASSET MANAGEMENT NORTH AMERICA 2024,International Solar Manufacturers Conference & Expo. Solar Asset Management North America is the most complete event on Solar Operations & Maintenance and Asset Management in North America,Public,once a year,http://www.solarplaza.com/event/solarplaza-summit-asset-management-north-america/#venue,s.cruccu@solarplaza.com,USA,False,2024-04-09,2,1018
EXPO SEGURIDAD MEXICO 2024,"The largest event for the security industry in Latin America. A 3-day event with technology, solutions and knowledge for manufacturers, distributors, integrators and users, national and foreign, who meet annualy to interact, update and exchange",Public,once a year,http://www.exposeguridadmexico.com/en-gb.html,info@exposeguridad.com,Mexico,False,2024-04-16,3,438
F&B AT SEA 2024,"Forum dedicated to future of Cruise Food and Beverage. Over 50 suppliers showcasing everything F&B, from meat, seafood, dairy, grains and plant-based alternatives to cocktails, cookware, menus, equipment and more",Public,once a year,http://www.seatradecruisefnb.com/en/home.html,A.Williams@Informa.com,USA,False,2024-04-10,2,1019
SAE WORLD CONGRESS EXPERIENCE '2024,International Congress & Exposition of Automotive Design Engineering,Public,once a year,http://www.sae.org/highlights/wcx,events@sae.org,USA,False,2024-04-16,3,1020
FDIC - FIRE DEPARTMENTS INSTRUCTORS CONFERENCE 2024,"Fire Departments Instructors Conference. With the largest gathering of decision-makers, trainers and experts – as well as manufacturers and suppliers, FDIC serves as a spearhead for networking & relationship development",Public,once a year,http://www.fdic.com/,info@clarionevents.com,USA,False,2024-04-15,6,699
ECOMONDO MEXICO 2024,"Ecomondo Mexico, leading international exhibition-conference, brings together all sectors supporting ecological transition: waste, water, reclamation, integrated services, energy efficiency, sustainable cities, mobility, green infrastructure...",Public,once a year,http://hfmexico.mx/ecomondo/en,andrea.alcocer@hfmexico.mx,Mexico,False,2024-04-17,3,784
AUTOMECHANIKA BUENOS AIRES 2024,Trade fair for the automotive service industry,Public,every 2 years,http://automechanika.ar.messefrankfurt.com/buenosaires/en.html,automechanika@argentina.messefrankfurt.com,Argentina,False,2024-04-10,4,523
BELLAVITA EXPO - TORONTO 2024,"The leading trade event outside Italy promoting the finest Italian food and beverages to thousands of buyers as well as educational content including the latest trends, masterclasses with Michelin-starred Chefs and debates",Public,once a year,http://www.bellavita.com/gb/toronto,info@quirismedia.com,Canada,False,2024-04-08,3,632
EXPO ABIOPTICA 2024,Expo Abióptica is one of the largest events in the Optical/Eyewear sector in Latin America,Public,once a year,http://www.expoopticabrasil.com/,autentica@expoabioptica.com.br,Brazil,False,2024-04-10,4,451
INTERSOLAR SUMMIT BRASIL NORDESTE 2024,'Intersolar Summit Brasil Nordeste' addresses leading local and international experts on solar power and renewable energy in the region,Public,once a year,http://www.intersolar.net.br/en/home/summit-brasil-nordeste,fsf@arandanet.com.br,Brazil,False,2024-04-10,2,443
NAB RADIO SHOW 2024,"Radio and advertising trade show. The broadcast, media and entertainment industry converges at the NAB Radio Show to experience innovation in action and harness the power of possibility",Public,once a year,http://nabshow.com/,exhibit@nab.org,USA,False,2024-04-13,5,429
AUTOCOM BRASIL 2024,"International Retail Automation Fair. Autocom is the most important Automation Event in Latin America. For many years, it has been gathering the main Technology Suppliers Sales Channels and Retailers",Public,once a year,http://feiraautocom.com.br/,atendimento@francal.com.br,Brazil,False,2024-04-09,3,451
IWCE - INTERNATIONAL WINDOW COVERINGS EXPO 2024,"The International Window Coverings Expo (IWCE), North America’s only trade show and conference dedicated to window covering professionals, is the largest business networking and education event for window treatment professionals",Public,once a year,http://www.iwce-vision.com/,info@wf-vision.com,USA,False,2024-04-11,2,1021
ZAK WORLD OF FAÇADES - USA - CHICAGO 2024,Zak World of Façades is an International conference series on façade design & engineering,Public,once a year,http://zakworldoffacades.com/,info@zakgroup.com,USA,False,2024-04-11,1,622
INTERPHEX '2024,"Pharmaceuticals Industries Exposition & Conference. INTERPHEX is the premier pharmaceutical, biotechnology, and device development and manufacturing event where you can “Experience Science through Commercialization”",Public,once a year,http://www.interphex.com/,inquiry@interphex.com,USA,False,2024-04-16,3,551
INDUSTRIE TRANSITION USA 2024,"The conference unites executive leaders from mining, metals, chemicals, transportation and other hard-to-abate industries, to accelerate deep decarbonization, forge new cross-sector coalitions and deliver net zero on an industrial scale",Public,once a year,http://events.reutersevents.com/energy-transition/industry-usa,zoe.wadsworth@thomsonreuters.com,USA,True,2024-09-01,1,1199
THE ARTIST PROJECT 2024,"Contemporary Art Expo. The Artist Project features original works from 250+ carefully juried, contemporary artists, from a variety of geographic & creative backgrounds converge & connect with patrons looking to get a glimpse of tomorrow’s Art Stars",Public,once a year,http://www.theartistproject.com/,info@iidexneocon.com,Canada,False,2024-04-11,4,1022
MALMS - MILITARY AVIATION LOGISTICS & MAINTENANCE SYMPOSIUM 2024,MALMS is a dynamic forum for members of the U.S. Military and public/private sectors of the aerospace industry to discuss process improvements and operational readiness concerns regarding aircraft maintenance and sustainment capabilities,Public,once a year,http://malms.aviationweek.com/en/home.html,events@aviationweek.com,USA,False,2024-04-10,2,497
SUPPLYSIDE EAST 2024,The East Coast’s leading ingredients and solutions tradeshow. Connect with more than 250 leading health & nutrition suppliers and service providers,Public,every 2 years,http://east.supplysideshow.com/en/home.html,headoffice@informa.com,USA,False,2024-04-16,2,1023
NORTH AMERICAN MANUFACTURING EXCELLENCE SUMMIT 2024,"Engineering & Manufacturing Summit. The North American Manufacturing Excellence Summit brings together top manufacturing executives, cutting edge technology providers and media partners for conferences & One-on-one meetings",Public,once a year,http://manufacturing-event.com/,info@executiveplatforms.com,USA,False,2024-04-14,3,1024
BUILDING BIOLOGY IN 3D SYMPOSIUM 2024,This two-day event will address the successes and limitations of using 3D systems in discovery and applied research while acknowledging the need for improvements to ensure widespread adoption,Public,once a year,http://www.slas.org/,bsacks@slas.org,USA,False,2024-04-16,2,1025
NAB SHOW 2024,"Digital Media & Entertainment Exhibition. From Broadcasting to Broader-casting®, the NAB Show® has evolved over the last eight decades to continually lead this ever-changing industry",Public,once a year,http://www.nabshow.com/,exhibit@nab.org,USA,False,2024-04-13,5,429
SEATRADE CRUISE GLOBAL 2024,International exhibition & conference serving the cruise industry. Seatrade Cruise Global brings together suppliers and buyers for a week of networking sourcing and education,Public,every 2 years,http://www.seatradecruiseglobal.com/en/home.html,info@cruiseshippingmiami.com,USA,False,2024-04-08,4,707
WTM LATIN AMERICA 2024,"The leading global event for the Latin American travel industry. By visiting WTM Latin America you will have the opportunity to meet, network and conduct business with exhibitors from across the globe all under one roof",Public,once a year,http://www.wtm.com/latin-america/en-gb.html,atendimentovisitante@rxglobal.com,Brazil,False,2024-04-15,3,451
INTERNATIONAL SIGN EXPO 2024,"Annual event for the global sign industry. See, demo and buy everything you need to be successful in the sign, graphics and visual communications industry at ISA International Sign Expo",Public,once a year,http://www.signexpo.org/,info@signs.org,USA,False,2024-04-09,4,485
WATS ORLANDO (WORLD AVIATION TRAINING CONFERENCE AND TRADESHOW) 2024,World Flight Training Conference and Tradeshow in Orlando,Public,once a year,http://wats-event.com/,info@halldale.com,USA,False,2024-04-29,4,1026
STAMP & SCRAPBOOK EXPO CHANTILLY 2024,"Art & Craft fair in Chantilly, V. STAMP & SCRAPBOOK EXPO CHANTILLY features craft show, craft shopping, paper craft, clay modelling, abstract arts, Art & Craft workshop, craft tools, creative ideas and crafts for kids",Public,once a year,http://www.scrapbookexpo.com/,Info@scrapbookexpo.com,USA,False,2024-04-26,2,734
IDEA 2024,The world's preeminent event for non woven & Engineered Fabrics. Conference & Expo,Public,every 3 years,http://www.ideashow.org/,info@inda.org,USA,False,2024-04-22,4,707
"SIMEC - SALON INDUSTRIEL DE LA MAURICIE, ESTRIE ET DU CENTRE-DU-QUÉBEC 2024","Industrial Expo in the Estrie region. The event brings together distributors, suppliers and service companies with the know-how needed for development and growth of businesses in the region",Public,every 2 years,http://salonsindustriels.com/en,info@promoapageau.com,Canada,False,2024-04-24,1,1027
INDY POP CON 2024,"INDY POP CON features comics, gaming, cosplay, animation film and video games, podcasting, literary arts, horror & sci-fi movies, contemporary music, themed merchandise, comet screening, eSports, toys, dance workshop",Public,once a year,http://www.indypopcon.com/,info@indypopcon.com,USA,False,2024-04-26,3,699
CERAMICS EXPO 2024,"Exhibition and Conference dedicated to the ceramic industry supply chain. Learn about the latest industry developments, source next-generation materials, and make new business connections",Public,once a year,http://www.ceramicsexpousa.com/,info@ceramicsexpousa.com,USA,False,2024-04-29,3,759
HD EXPO 2024,Expo and Conference exclusively for the Hospitality Design Industry,Public,once a year,http://www.hdexpo.com/,HospitalityDesign@experient-inc.com,USA,False,2024-04-30,3,620
WAUSAU - ROTHSCHILD GUN SHOW 2024,"Arms Expo. WAUSAU-ROTHSCHILD GUN SHOW features shooting rifles, shotguns, hunting knife, rifle spoke, bulletproof jackets, ear plugs, fishing accessories, gun safes & cases, ammo and laser optics",Public,unknown,http://gunshowtrader.com/gunshows/wisconsin-gun-shows,,USA,False,2024-04-19,3,1028
BETT BRAZIL - EDUCAR 2024,"International conference & exhibition for education, learning technologies & Information and Communications Technologies",Public,once a year,http://brasil.bettshow.com/,info@ascential.com,Brazil,False,2024-04-23,4,959
THE FRANCHISE EXPO - OTTAWA 2024,North America's Franchise & Business Opportunities Event. THE FRANCHISE EXPO showcases the fastest growing franchises & business opportunities with thousands of potential franchisees & business partners eager ready to invest,Public,once a year,http://www.franchiseshowinfo.com/ottawa/visitor,info@nationalevent.com,Canada,False,2024-04-20,2,769
HOME IMPROVEMENT & DESIGN EXPO - WHITE BEAR LAKE 2024,"Home Improvement & Design Show. Home Improvement & Design Expo WHITE BEAR LAKE will enable you to meet decorators, builders, remodelers, designers, suppliers and other professionals with expertise in the home improvement and design industry",Public,once a year,http://minnesotahomeshows.com/show-schedule,contact@minnesotahomeshows.com,USA,False,2024-04-20,1,1029
HEIMTEXTIL COLOMBIA 2024,International Trade Fair Floor Wall-Window Decoration & Furniture Fabrics Bed-Bath-Table & Kitchen Linen,Public,once a year,http://heimtextilcolombia.com/,info@inexmoda.org.co,Colombia,False,2024-04-23,3,638
RIO OIL & GAS EXPO 2024,Rio Oil & Gas Expo and Conference,Public,every 2 years,http://www.riooilgas.com.br/en,riooil@ibp.org.br,Brazil,False,2024-09-23,4,459
SALON DU VÉHICULE ÉLECTRIQUE DE MONTRÉAL 2024,Montreal Electric Vehicle Trade Show. One of the major events of the year in Canada for industry and the general public in the field of new technologies and electric transport and mobility,Public,once a year,http://svem.ebems.com/home.html,info@svem.ca,Canada,False,2024-04-19,3,857
SUNCOAST BOAT SHOW 2024,"Boat Show in Sarasota. SUNCOAST BOAT SHOW features hundreds of Boats from 8 foot inflatables, power boats, fishing boats, center consoles, bow riders, personal watercraft to superyachts & a full range of marine electronics, products & accessories",Public,once a year,http://www.suncoastboatshow.com/,webmaster@nmma.org,USA,False,2024-04-19,3,1030
CONSTRU EXPO 2024,International Construction & Building Fair,Public,every 2 years,http://feriaconstruexpo.com/,mercadeoynegocios@casalco.org.sv,Salvador,False,2024-04-24,4,1031
SPIE DEFENSE + COMMERCIAL SENSING 2024,"Exhibition & conferences for defense, security, industry and environment. The Defense, Security and Sensing Exhibition is the industry's leading exhibition with 500 top defense, security, and sensing contractors, suppliers, and integrators",Public,once a year,http://spie.org/conferences-and-exhibitions/defense--commercial-sensing,consumerservice@spie.org,USA,False,2024-04-21,5,1032
PROVEDORES DE INTERNET + DATACENTERS 2024,Congress dedicated to Internet Providers and Data Centers,Public,once a year,http://rtiprovedoresdeinternet.com.br/,fsf@arandanet.com.br,Brazil,False,2024-04-17,2,443
SOLAR & STORAGE MEXICO 2024,Solar Power Mexico is the first exhibition and conference specialized in the energy and solar technology segment,Public,once a year,http://www.hfmexico.mx/solarpowermexico,info@hmexico.mx,Mexico,False,2024-04-17,3,784
SMALL BUSINESS EXPO PHILADELPHIA 2024,"Business Trade Show. Small Business Expo brings together thousands of business owners and decision-makers to network, attend business critical workshops, build new business relationships and shop from vendors that provide unique products & services",Public,once a year,http://www.thesmallbusinessexpo.com/city/philadelphia-2,info@theshowproducers.com,USA,False,2024-04-17,1,1033
WAUKESHA EXPO GUN SHOW 2024,"Guns & Knives show. WAUKESHA EXPO GUN SHOW presents automatic firearms, combat knife, militaria of war, fishing gears, antique pistols, cartridges, hunting accessories, gun cases & safes, self protection weapons and hi-tech optics",Public,unknown,http://gunshowtrader.com/gunshows/wisconsin-gun-shows,,USA,False,2024-04-26,3,1034
WORLD ORPHAN DRUG CONGRESS USA 2024,Biopharma Conference & Exhibition devoted to the Orphan Drug Industry in the USA,Public,once a year,http://www.terrapinn.com/conference/world-orphan-drug-congress-usa,william.horgan@terrapinn.com,USA,False,2024-04-23,3,764
FENASOJA 2024,"National Soybean Fair, dedicated to companies related to the soybean production chain and others",Public,every 2 years,http://www.fenasoja.com.br/,fenasoja@fenasoja.com.br,Brazil,False,2024-04-26,10,1035
FIRE RETARDANTS IN PLASTICS NORTH AMERICA 2024,Congress dedicated to Fire Retardants in Plastics. Exploring trends and technical developments in the international fire retardant industry,Public,once a year,http://www.ami.international/events/upcoming,consult@amiplastics-na.com,USA,False,2024-04-23,2,1036
OC HOME & GARDEN SHOW 2024,"Home improvements and remodeling show in Anaheim, CA. ORANGE COUNTRY HOME & GARDEN SHOW features furniture, kitchen appliances, bathroom designs, construction & renovation services, re-modeling ideas, interior designers...",Public,once a year,http://www.homeshowconsultants.com/,showofficehsc@gmail.com,USA,False,2024-04-19,3,803
WORLD’S LEADING WINES CHICAGO 2024,"Sourcing Event for Wine Importers & Distributors. The World’s Leading Wines events are series of targeted trade tastings, networking events and dinners attended exclusively by the head wine buyers from leading importers and distributors",Public,once a year,http://theworldsleadingwines.com/events_usa/chicago,info@worldsleadingwines.com,USA,False,2024-04-17,1,1037
VINOTECH BRASIL 2024,Wine Process Expo,Public,every 2 years,http://www.envasebrasil.com.br/vinotech,mefazal99rehman@yahoo.com,Brazil,False,2024-04-23,3,1038
ANNAPOLIS SPRING SAILBOAT SHOW 2024,"Trade Show for boat industry and sailing items. ANNAPOLIS SPRING SAILBOAT SHOW features first sail workshop, newly designed sail boats, yachts, catamarans, trimarans, advanced tools, boating accessories, navigational equipment & high-tech electronics",Public,once a year,http://www.annapolisboatshows.com/annapolis-spring-sailboat-show,info@annapolisboatshows.com,USA,False,2024-04-26,3,1039
THE ULTIMATE WOMEN'S SHOW - NEW-YORK 2024,"The Nation's Largest Women's Expos, combining the very best in shopping, speakers, makeovers and rejuvenation designed for the Ultimate Experience for women",Public,unknown,http://thewomensexpo.com/,info@ultimatewomensshow.com,USA,False,2024-04-27,2,685
INFOAGRO MÉXICO EXHIBITION 2024,"Agricultural Products Fair. Exhibitors will be able to present their products to visitors. In addition, they will have a B2B area, where they can chat with customers",Public,once a year,http://mexicoinfoagroexhibition.com/,mexico@infoagro.com,Mexico,False,2024-04-24,3,1040
CAPA AMERICAS AVIATION SUMMIT 2024,"The ""CAPA Americas Aviation and LCCs Summit"" is exploring the key strategic issues facing airlines, airports, and the wider travel industry in North America, as well as exploring wider global developments and sector-specific challenges",Public,once a year,http://events.aviationweek.com/,events@centreforaviation.com,USA,False,2024-04-26,2,1041
ITS AMERICA CONFERENCE & EXPO 2024,"ITS America Conference & Expo will bring together the entire intelligent transportation community for thought-provoking education, networking, and demonstrations exploring the technologies and future solutions",Public,once a year,http://www.itsamericaevents.com/expo/en-us.html,inquiry@reedexpo.com,USA,False,2024-04-22,4,630
NEW ENGLAND HOME SHOW - TOPSFIELD 2024,"Topsfield, MA Home and Garden Show",Public,once a year,http://www.newenglandhomeshows.com/,richcastig@comcast.net,USA,False,2024-04-20,2,1042
CALL & CONTACT CENTER EXPO - LAS VEGAS 2024,The Call & Contact Center Expo is the leading customer engagement and business intelligence event in US,Public,once a year,http://www.callandcontactexpo.us/,inquiries.ccmi@fortem-international.com,USA,False,2024-04-24,2,429
THE ULTIMATE WOMEN'S SHOW - ARIZONA 2024,"The Nation's Largest Women's Expos, combining the very best in shopping, speakers, makeovers and rejuvenation designed for the Ultimate Experience for women",Public,twice a year,http://www.azwomensexpo.com/,info@ultimatewomensshow.com,USA,False,2024-04-20,2,630
EMERGENCYTECH 2024,International Fair of Technology in Medical Emergency Services. The fair brings together the suppliers and representatives of the most important institutions in the Emergency Medical Services sector in Latin America,Public,once a year,http://feria-emergencytech.com/,feria.emergencytech@gmail.com,Colombia,True,2024-09-01,1,424
TRUCK WORLD 2024,"Canada's Trucking Industry Trade Expo. Truck World is the Canadian meeting place for the trucking, transportation, supply chain, distribution, and logistics industries",Public,every 2 years,http://www.truckworld.ca/,joanw@newcom.ca,Canada,False,2024-04-18,3,826
WORLD’S LEADING WINES SAN FRANCISCO 2024,"Sourcing Event for Wine Importers & Distributors. The World’s Leading Wines events are series of targeted trade tastings, networking events and dinners attended exclusively by the head wine buyers from leading importers and distributors",Public,once a year,http://theworldsleadingwines.com/events_usa/sanfrancisco,info@worldsleadingwines.com,USA,False,2024-04-19,1,1043
AGRISHOW 2024,Agrishow is the biggest and most important agricultural technology trade show in Brazil and one of the largest in the world,Public,once a year,http://www.agrishow.com.br/en/home.html,agrishow@agrishow.com.br,Brazil,False,2024-04-29,5,979
C2E2 - CHICAGO COMIC & ENTERTAINMENT 2024,Chicago Comic & Entertainment Expo,Public,once a year,http://www.c2e2.com/,inquiry@reedexpo.com,USA,False,2024-04-26,3,497
ART MARKET SAN FRANCISCO 2024,Contemporary Art Fair in San Francisco,Public,once a year,http://artmarketsf.com/,info@amp.events,USA,False,2024-04-25,4,1044
SPIE DEFENSE + COMMERCIAL SENSING EXPO 2024,"Specialized conferences & exhibition dedicated to sensors, optics, imaging, lasers, and related areas for defense, security, industry, and the environment",Public,once a year,http://spie.org/conferences-and-exhibitions/defense--commercial-sensing,hermann@spieeurope.org,USA,False,2024-04-21,5,1032
BETT BRASIL EDUCAR 2024,"Education Show. Bett Brasil Educar, Latin America’s largest education show & conference features a combination of the best products & services for the education sector with a selection of congresses & seminars featuring national & international specialis",Public,once a year,http://www.bettbrasileducar.com.br/,contato@bettbrasileducar.com.br,Brazil,False,2024-04-23,4,959
AUVSI'S XPONENTIAL 2024,"Exhibition and conference on the latest developments in the unmanned systems technologies for air, land and sea",Public,once a year,http://www.auvsi.org/events/xponential/xponential-2024?source=search-events,info@auvsi.org,USA,False,2024-04-22,4,891
ZAK WORLD OF FAÇADES - USA - LOS ANGELES 2024,Zak World of Façades is an International conference series on façade design & engineering,Public,once a year,http://zakworldoffacades.com/,info@zakgroup.com,USA,False,2024-04-18,1,798
THE FRANCHISE EXPO - CHICAGO 2024,North America's Franchise & Business Opportunities Event. THE FRANCHISE EXPO showcases the fastest growing franchises & business opportunities with thousands of potential franchisees & business partners eager ready to invest,Public,once a year,http://www.franchiseshowinfo.com/chicago/visitor,info@nationalevent.com,USA,False,2024-04-27,2,576
RE+ SOUTHEAST 2024,RE+ Southeast attracts energy professionals from across the solar and storage markets each year to facilitate business and connections,Public,once a year,http://re-plus.events/southeast,customerservice@re-plus.com,USA,False,2024-04-17,2,731
INCENTIVE LIVE 2024,"Incentive Industry's Top Professionals Event. The biggest trends, the biggest influencers, the biggest spenders – all come together for three highly productive days",Public,once a year,http://www.northstarmeetingsgroup.com/Events/Incentive-Live,cbinder@ntmllc.com,USA,False,2024-04-28,3,1045
RAPID + TCT 2024,Event focused on solutions for accelerating products to market. The Event for Printing and Additive Manufacturing Intelligence,Public,once a year,http://rapid3devent.com/,rapid.tct@sme.org,USA,False,2024-04-23,3,803
