id,event_name,description,audience,cycle,website,email,country,date_uncertain,date,duration_days,venue_id
7381,BÂTIR 2024,"Home Building, Renovation & decoration Fair",Public,once a year,http://www.foiredenice.com/,contact@nicexpo.org,France,False,2024-03-09,10,1619
7382,MOSTRA CONVEGNO EXPOCOMFORT - EXPOBAGNO 2024,International Exhibition for the HVAC and Plumbing Sectors,Public,every 2 years,http://www.mcexpocomfort.it/,mce@fmi.it,Italy,False,2024-03-12,4,1273
7383,ESEF 2024,"International Trade Fair for Suppliers, Contractors and Engineers in: Metal working, Industrial Systems and Modules, Engineering & Design, Surface technology, Rubber and Plastics industry, Stamps and Moulds, Electronic Contract Manufacturing…",Public,every 2 years,http://www.jaarbeurs.nl/agenda/esef-maakindustrie-2024,service@jaarbeurs.nl,Netherlands,False,2024-03-12,4,1399
7384,CFIA RENNES 2024,"Crossroads of suppliers to the food industry. CFIA RENNES is a trade fair bringing together equipment manufacturers, suppliers and service providers from the Food Industry",Public,once a year,http://www.cfiaexpo.com/,cfia@gl-events.com,France,False,2024-03-12,3,1375
7385,HOSTELCO 2024,"International Restaurant, Hotels and Community Equipment",Public,every 2 years,http://www.hostelco.com/en/home,hostelco@firabarcelona.com,Spain,False,2024-03-12,4,1336
7386,MODEL EXPO ITALY 2024,"Model Expo Italy is the most important event in Italy for static and dynamic modelling and games. It boasts a calendar with more than 100 events, including interactive workshops and shows, 450+ exhibitors (companies, associations) and 10 theme areas",Public,once a year,http://www.modelexpoitaly.it/en,fo@modelexpoitaly.it,Italy,False,2024-03-09,2,1313
7387,INDEPENDENT HOTEL SHOW - AMSTERDAM 2024,Business Event for the Hotel Community. 'Independent Hotel Show' is the only live business platform dedicated entirely to the needs of luxury and boutique hoteliers in the UK,Public,once a year,http://www.independenthotelshow.nl/,mieke.berkers@montgomerygroup.com,Netherlands,False,2024-03-12,2,1472
7388,OBUV. MIR KOZHI 2024,"International Exhibition of Footwear, leather articles and Production Equipment",Public,twice a year,http://www.obuv-expo.ru/en,centr@expocentr.ru,Russia,False,2024-03-12,4,1358
7389,ALIMENTARIA 2024,"A can’t-miss international fair for food, beverage and food service industry professionals",Public,every 2 years,http://www.alimentaria.com/,alimentaria-bcn@alimentaria.com,Spain,False,2024-03-12,4,1336
7390,SECOND HOME EXPO 2024,"Belgian Second Home Show. Do you dream of having your own vacation home? At the Second Home Expo, let yourself be inspired by more than 25, 000 vacation homes in more than 25 countries",Public,twice a year,http://www.secondhome-expo.be/en,info@flandersexpo.be,Belgium,False,2024-03-09,2,1616
7391,RECYCLING EXPO 2024,Polish International Trade Fair for Recycling and Resource Recovery Technologies,Public,once a year,http://recyclingexpo.pl/en,info@warsawexpo.eu,Poland,False,2024-03-12,3,1419
7392,FLOREVENT 2024,"FlorEvent is the leading trade show for florists, plant professionals, events and decoration in France",Public,unknown,http://digiflor.fr/,annemarie.frapard@gmail.com,France,False,2024-03-10,2,1439
7393,OI - OCEANOLOGY INTERNATIONAL 2024,Oceanology Exhibition,Public,every 2 years,http://www.oceanologyinternational.com/,oi.helpline@reedexpo.co.uk,UK - United Kingdom,False,2024-03-12,3,1474
7394,ANTIC AUTO ALICANTE 2024,"International Exhibition of Cars, Motorbikes and Spare Ancient and Classic",Public,once a year,http://www.feria-alicante.com/ferias,ifa@ifavirtual.com,Spain,False,2024-03-09,2,1427
7395,INLEGMASH 2024,"International Exhibition for Equipment and Technologies in the light industry, as well as technical textile and nonwovens",Public,once a year,http://www.inlegmash-expo.ru/en,centr@expocentr.ru,Russia,False,2024-03-11,4,1358
7396,MIPIM 2024,"International Real Estate Event. MIPIM, the world’s property market, brings together players from all international property sectors - office, residential, retail, healthcare, sport, logistics & industrial",Public,once a year,http://www.mipim.com/,info.mipim@reedmidem.com,France,False,2024-03-12,4,1487
7397,SCHOOL AND NURSERY EQUIPMENT EXHIBITION 2024,School and Nursery Equipment Exhibition,Public,once a year,http://mtp.pl/pl/kalendarium,info@grupamtp.pl,Poland,False,2024-03-08,3,1381
7398,BABY DAYS - GAND 2024,"Fair for parents-to-be and their babies. All new products. Conferences and events where professionals will advise you on food, care and health, breastfeeding, help during pregnancy, childbirth, nurseries...",Public,once a year,http://www.babydays.be/fr/salons/gand.php,info@babydays.be,Belgium,False,2024-03-09,2,1987
7399,FOODTEC 2024,Exhibition for Food Processing Technologies & Equipment,Public,every 2 years,http://messukeskus.com/events/?lang=en,customer.servive@messukeskus.com,Finland,False,2024-03-13,2,1368
7400,ARCHITECT @ WORK - DENMARK 2024,"Exhibition for Architecture & Interior Design. ARCHITECT@WORK gives you the opportunity to get into contact with: architects, interior architects, designers, engineering bureaus, project developers, technical services, towns & district councils",Public,every 2 years,http://www.architectatwork.dk/en/home,denmark@architectatwork.com,Denmark,False,2024-03-13,2,1407
7401,PACTEC 2024,International Packaging Industries Fair,Public,every 3 years,http://messukeskus.com/events/?lang=en,info@finnexpo.fi,Finland,False,2024-03-13,2,1368
7402,SALON MONDIAL DU TOURISME 2024,International Tourism Fair,Public,once a year,http://www.salons-du-tourisme.com/Paris,Marianne.chandernagor@comexposium.com,France,False,2024-03-14,4,1343
7403,DRAPERS SUSTAINABLE FASHION CONFERENCE 2024,Join 'Drapers Sustainable Fashion Conference' to learn how fashion retail can action change for a responsible future,Public,once a year,http://sustainablefashion.drapersonline.com/,info@emap.com,UK - United Kingdom,False,2024-03-13,1,1988
7404,SOLUTIONS CSE NANTES 2024,"Fair for works councils, staff representatives and local authorities. A multitude of ""Culture, Leisure & Relaxation"" outings, good holiday plans, providing service and comfort to employees…",Public,twice a year,http://www.solutions-cse.org/salons-cse/salon-cse-nantes,aubagne@exposium.fr,France,False,2024-03-14,2,1374
7405,GASTROPAN 2024,"Exhibition for the Baking, Pastry, Confectionery, Ice Cream, Chocolate, Coffee, Hospitality and Food Service Industries",Public,once a year,http://www.gastropan.ro/index.php/en,info@gastropan.ro,Romania,False,2024-03-14,3,1989
7406,EUROGIN CONGRESS 2024,International Multidisciplinary HPV (Human papillomavirus) congress,Public,once a year,http://www.eurogin.com/,admin@eurogin.com,Sweden,False,2024-03-13,4,1990
7407,SALON DESTINATIONS NATURE 2024,"Tourism, Travel and Outdoor Expo",Public,once a year,http://www.randonnee-nature.com/,contact@randonnee-nature.com,France,False,2024-03-14,4,1343
7408,SOLUTIONS CSE ROUEN 2024,"Fair for works councils, staff representatives and local authorities. A multitude of ""Culture, Leisure & Relaxation"" outings, good holiday plans, providing service and comfort to employees…",Public,twice a year,http://www.solutions-cse.org/salons-cse/salon-cse-rouen,aubagne@exposium.fr,France,False,2024-03-14,2,1441
7409,SEJEM DOM - HOME FAIR 2024,"This Fair is intended to present Slovenian and Foreign Manufacturers of Products for the Home and Surroundings, Construction Products, Doors and Windows",Public,once a year,http://www.sejemdom.si/,info@gr-sejem.si,Slovenia,False,2024-03-13,5,1482
7410,DENTAL-EXPO VOLGOGRAD 2024,"Dental equipment, Dental instruments and Dental materials expo & forum in Volgograd",Public,once a year,http://en.dental-expo.com/en-volgograd-de,info@dental-expo.com,Russia,False,2024-03-13,3,1991
7411,SALON DES SENIORS 2024,"Senior & Retirement Expo in France. Tourism, Lifestyle, Health, Wellness, Financial & Juridical Services, IT Technologies...",Public,once a year,http://www.salondesseniors.com/,info@pgorganisation.fr,France,False,2024-03-13,4,1343
7412,WORLD EPA CONGRESS 2024,"Europe’s largest congress in market access, pricing and evidence featuring 250 speakers, multiple streams and over 1000 attendees from pharma, biotech and Payers/HTA’s",Public,once a year,http://www.terrapinn.com/conference/pharma-pricing/index.stm,tayyab.abbasi@terrapinn.com,Netherlands,False,2024-03-12,2,1472
7413,IT-PARTNERS 2024,Trade Sales Business Club IT. Business Meeting about Computer and Application B to B,Public,once a year,http://www.it-partners.fr/,pierre.le-roy@reedexpo.fr,France,False,2024-03-13,2,1992
7414,CONSTRUCTION AND ARCHITECTURE 2024,"Specialized exhibition of building projects and architectural designs, new technologies and building equipment, construction and finishing materials. Annual contest of architectural designs",Public,once a year,http://www.krasfair.ru/events,artem@krasfair.ru,Russia,False,2024-03-13,4,1637
7415,INTEGRATION 2024,"International Specialized Fair and Congress for Rehabilitation, Care, Physiotherapy, Prosthetics and Orthotics, Mobility, Inclusion World and Living",Public,once a year,http://integration.ru/en,info@expo-fusion.ru,Russia,False,2024-03-13,3,1993
7416,ART3F NANTES 2024,"International Contemporary Art Expo in Nantes. Art3f hosts galleries, painters, sculptors, photographers and performers",Public,once a year,http://www.art3f.fr/nantes-fr,info@art3f.com,France,False,2024-03-15,3,1374
7417,INTERNATIONAL EDUCATION EUROPE EXPO ROADSHOW - BARCELONA 2024,International Student Fairs,Public,once a year,http://universityfairs.com/fairs?from=&to=&inRegion=0&inCountry=26,info@universityfairs.com,Spain,False,2024-03-13,5,1994
7418,SOLUTIONS CSE LYON 2024,"Fair for works councils, staff representatives and local authorities. A multitude of ""Culture, Leisure & Relaxation"" outings, good holiday plans, providing service and comfort to employees…",Public,twice a year,http://www.solutions-cse.org/salons-cse/salon-cse-lyon,aubagne@exposium.fr,France,False,2024-03-14,2,1513
7419,FISHING & HUNTING EXPO 2024,Fishing & Hunting Expo,Public,once a year,http://www.fishingandhuntingexpo.ro/,marketing@fishingandhuntingtv.com,Romania,False,2024-03-14,4,1536
7420,TEXTILE COLLECTION MOSCOW 2024,"International trade fair of apparel production sourcing. Fabrics, yarns & threads, trims & accessories, ready-to-wear garment items for branded collections production, sewing machines, printing equipment, fashion retail solutions",Public,once a year,http://en.textile-collection.com/,info@gefera.ru,Russia,False,2024-03-12,3,1283
7421,SOLARPLAZA SUMMIT BALTICS 2024,Gain crucial insights into the growing and evolving solar energy market. You'll also be able to strengthen your network by meeting the major market players,Public,once a year,http://www.solarplaza.com/event/solarplaza-summit-baltics,j.trip@solarplaza.com,Lithuania,False,2024-03-14,1,1995
7422,WORLD OF FURNITURE 2024,"International Exhibition for Furniture, Interior Textile and Home Accessories",Public,once a year,http://furnitureexpo.bg/index.php/en/95-exibiton/145-furnitureexpo,tm@iec.bg,Bulgaria,False,2024-03-13,4,1493
7423,GASTRO HELSINKI 2024,Gastronomy Fair,Public,every 2 years,http://gastro.messukeskus.com/,customer.servive@messukeskus.com,Finland,False,2024-03-13,3,1368
7424,SANDWICH & SNACK SHOW 2024,"Sandwich & Snack Show is the benchmark show that brings together out-of-home and nomadic catering professionals who want to develop, premiumize or relaunch their business thanks to new trends and new snacking concepts",Public,once a year,http://www.sandwichshows.com/,Florence.aynie@reedexpo.fr,France,False,2024-03-13,2,1343
7425,BAUEN WOHNEN GARTEN 2024,"Garden, Home and Construction Show. Builders and homeowners will get a diverse insight into the topics of green and value-for-money construction, renovation and fit-out",Public,once a year,http://www.bauenwohnengarten.de/fr,info@messeoffenburg.de,Germany,False,2024-03-15,34,1824
7426,B-TRAVEL 2024,International Tourism Salon in Catalonia,Public,once a year,http://www.b-travel.com/,info@firabarcelona.com,Spain,False,2024-03-15,3,1645
7427,PROPET MADRID 2024,Pet Industry Trade Fair,Public,once a year,http://www.ifema.es/en/iberzoo-propet,propet@ifema.es,Spain,False,2024-03-13,3,1328
7428,BAUEN & WOHNEN - MÜNSTER 2024,"Building & Living Exhibition. The event presents all topics relating to building, renovation, furnishing and design",Public,once a year,http://muenster.bau-messen.de/,info@bau-messen.de,Germany,False,2024-03-15,3,1471
7429,HOLIDAY & SPA EXPO 2024,Tourism exhibition HOLIDAY & SPA EXPO is the premier event of the Tourism Industry in Bulgaria which gathers leading local and foreign companies every year,Public,once a year,http://holidayfair-sofia.com/en,primexpo@primdesign.com,Bulgaria,False,2024-03-13,3,1493
7430,FERIEN-MESSE WIEN 2024,"Plenty of New Ideas on how to Lead a Healthy Life, on Spa Hotels and Saunas, and on how to organize your Leisure Time",Public,once a year,http://www.ferien-messe.at/,ferien@rxglobal.com,Austria,False,2024-03-14,4,1480
7431,WOHNEN & INTERIEUR-MESSE 2024,"Austria’s largest Fair for Dream Interiors, Design Lifestyle, Accessories and Garden together with Orientierung: Austria's Trade Fair for Interior Furnishings, Kitchen, Upholstery and Mattresses",Public,once a year,http://www.wohnen-interieur.at/,wohnen@rxglobal.com,Austria,False,2024-03-13,5,1480
7432,PLAST EXPO NORDIC 2024,Plastic Industry International Trade Show,Public,every 2 years,http://messukeskus.com/events/?lang=en,info@finnexpo.fi,Finland,False,2024-03-13,2,1368
7433,GIARDINA ZÜRICH 2024,Zurich Garden and Gardening Fair,Public,once a year,http://www.giardina.ch/,info@giardina.ch,Switzerland,False,2024-03-13,5,1353
7434,VENDING PARIS 2024,"International exhibition dedicated to automatic vending systems & equipment. Vending PARIS, an international event, attracts all Vending professionals to take stock, discuss, learn, anticipate the future...",Public,every 2 years,http://www.vendingparis.com/,communication.france@rxglobal.com,France,False,2024-03-13,2,1343
7435,FESTIVAL DES LOISIRS CRÉATIFS DE GRENOBLE 2024,"Creative leisure fair in Grenoble. The exhibitors offer you their products, their novelties and advise you for your creative activities",Public,once a year,http://festivalcreatifgrenoble.com/,sonia.hiboux@alpexpo.com,France,False,2024-03-14,4,1468
7436,LOW-RISE HOUSE BUILDING SHOW 2024,"Exhibition dedicated to cottage and individual construction, interior and exterior finishing, landscape architecture and design",Public,every 2 years,http://www.krasfair.ru/events,artem@krasfair.ru,Russia,False,2024-03-13,4,1637
7437,CAREER EXPO - PRAHA 2024,Job fair in Prague. Meetings between employers and young talents,Public,once a year,http://profesiadays.cz/en,vystava@profesia.sk,Czech Republic,False,2024-03-13,2,1996
7438,EXPODENTAL MADRID 2024,"Dental Equipment, Supplies and Services Show",Public,every 2 years,http://www.ifema.es/en/expodental,expodental@ifema.es,Spain,False,2024-03-14,3,1328
7439,IBERZOO + PROPET 2024,International Pet Professional Fair,Public,once a year,http://www.ifema.es/en/iberzoo-propet,ibzpropet@ifema.es,Spain,False,2024-03-13,3,1328
7440,CINEGÉTICA 2024,International Hunting and Fishing Fair,Public,once a year,http://cinegetica.es/en,info@cinegetica.es,Spain,False,2024-03-14,4,1328
7441,TECHSTROYEXPO. ROADS 2024,"Specialized trade show for road-building machinery, technologies, construction and warehousing equipment",Public,every 2 years,http://www.krasfair.ru/events,artem@krasfair.ru,Russia,False,2024-03-13,4,1637
7442,ABILMENTE TORINO 2024,"Do-it-Yourself Exhibition. Abilmente, Torino - the International Expo-Atelier dedicated to Creative Crafting is for all enthusiasts looking to discover the very latest products and trends in the hobby and DIY crafting world",Public,once a year,http://www.abilmente.org/en,info@iegexpo.it,Italy,False,2024-03-14,4,1438
7443,SEATEC 2024,Seatec is the International Exhibition of Technologies and Subcontracting for Boat and Shipbuilders,Public,once a year,http://www.sea-tec.it/,seatec@carrarafiere.it,Italy,False,2024-03-14,2,1957
7444,PARIZZA 2024,"Covering all Italian catering trades (food products, beverages, packaging, equipment, services, technology, etc.), Parizza welcomes all professionals in the sector and the French Pizza Championship",Public,once a year,http://www.parizza.com/,Florence.aynie@reedexpo.fr,France,False,2024-03-13,2,1343
7445,W3 + FAIR WETZLAR 2024,"Optics, Electronics & Mechanics Trade Fair. W3+ FAIR attracts actors from the fields of product development, precision, system & product engineering, material selection, production, measurement technology, mechatronics, microsystem & nanotechnology",Public,once a year,http://w3-messe.de/en,info@fleet-events.de,Germany,False,2024-03-13,2,1997
7446,BAUMESSE NRW 2024,"Combinated Building and Real Estate Exhibition. Eco Building, Real Estate and Vacation Properties",Public,once a year,http://www.baumessenrw.de/,medien@westfalenhallen.de,Germany,False,2024-03-15,3,1455
7447,THE CLEANING SHOW 2024,The Cleaning Show is the UK's largest trade event focused on Cleaning & Hygiene,Public,once a year,http://www.cleaningshow.co.uk/,vanessavss@quartzltd.com,UK - United Kingdom,False,2024-03-13,2,1922
7448,ZAK WORLD OF FAÇADES - IRELAND 2024,Zak World of Façades is an International conference series on façade design & engineering,Public,once a year,http://zakworldoffacades.com/,info@zakgroup.com,Ireland,False,2024-03-14,1,1998
7449,BUILDING AND RECONSTRUCTION EXPO 2024,Building and Reconstruction Exhibition,Public,once a year,http://expo.am/en/stroitelstvo_i_remont,expo@expo.am,Armenia,False,2024-03-15,3,1473
7450,FOR BOAT 2024,"Specialized boat show. Water sports, boats, waterboats, sailing boats, luxury yachts and motor boats",Public,once a year,http://forboat.cz/en,gr@abf.cz,Czech Republic,False,2024-03-15,3,1376
7451,MOVE IT 2024,"Annual London event dedicated to dance. MOVE IT is a unique, high energy event that’s brings together 30, 000 learners, teachers, artists, studios and brands for three days packed with the best talent and creativity, all under one roof",Public,once a year,http://www.moveitdance.co.uk/,,UK - United Kingdom,False,2024-03-15,3,1474
7452,SALON DE L'HABITAT DE CHARTRES 2024,"Chartres Home Show. Single-family home builders, developers, real estate agents and experts, banks and property managers, notaries...",Public,once a year,http://www.salonhabitat-chartres.com/,evenements@centrefrance.com,France,False,2024-03-16,2,1420
7453,"SALON DE L'APPRENTISSAGE, DE L'ALTERNANCE ET DES MÉTIERS DE MARSEILLE 2024","Exhibition of apprenticeship, work-study and trades",Public,once a year,http://salon-apprentissage-alternance-et-metiers-marseille.salon.letudiant.fr/,info@letudiant.fr,France,False,2024-03-15,2,1538
7454,SALON DE L'HABITAT DU MANS 2024,Home Show for the city of Le Mans,Public,once a year,http://www.salondelhabitat.com/,cem@lemans-centrexpos.com,France,False,2024-03-15,3,1529
7455,EAT & DRINK FESTIVAL - LONDON 2024,"The UK’s favourite indoor food festival- celebrating the best in modern cuisine, mixology (cocktails) and independent produce all under one roof",Public,once a year,http://www.eatanddrinklondon.com/,richard@media-ten.com,UK - United Kingdom,False,2024-03-15,17,1435
7456,MOSCOW INTERNATIONAL INVESTMENT SHOW 2024,Russia's Specialized International Investment show,Public,twice a year,http://investshow.ru/eng,moscow@aigroup.ru,Russia,False,2024-03-15,2,1531
7457,CAMP VILLMARK 2024,Scandinavian Game Fair,Public,once a year,http://novaspektrum.no/,nv@messe.no,Norway,False,2024-03-15,3,1380
7458,SALON MAISON & JARDIN D'ALBERTVILLE 2024,"The show brings together a wide range of professionals to advise you on how to make your projects a reality. Specialists in construction, renovation, interior and exterior fittings, with an area dedicated to gardening, all activities will be represented !",Public,once a year,http://leopro.fr/salon-maison-jardin-albertville,manteslajolie@salonhabitat.net,France,False,2024-03-15,3,1469
7459,NATURAVENTURE 2024,"Nature sports fair. Racing, hiking, horseback riding, cycling, climbing, skiing, canoeing, surfing, sailing, fishing...",Public,once a year,http://www.salon-naturaventure.com/,parcexpo@montpellier-events.com,France,False,2024-03-15,4,1486
7460,AUTOSALON CHEMNITZ 2024,Motor Show,Public,once a year,http://www.autosalon-chemnitz.de/,info@messe-chemnitz.com,Germany,False,2024-03-16,2,1851
7461,ESTETIKA 2024,Beauty Expo for Professionals,Public,twice a year,http://www.estetika.be/,info@artexis.com,Belgium,False,2024-03-16,3,1276
7462,FIERA DELL’ELETTRONICA DI CONSUMO - VICENZA 2024,"Exhibition / market dedicated to enthusiasts, amateurs, collectors and users of consumer electronics",Public,once a year,http://multimediatre.it/index.php/calendario-fiere,info@fieradellelettronica.net,Italy,False,2024-03-15,3,1456
7488,ITM – INTOURMARKET MOSCOW 2024,"International Trade Fair for Travel & Tourism, co-organized with the Russian Federal Agency for Sport & Tourism",Public,once a year,http://www.itmexpo.ru/en,itm@expotour.org,Russia,False,2024-03-16,3,1358
7463,"LE SALON MASTERS ET MASTÈRES SPÉCIALISÉS, EN FRANCE ET À L'ÉTRANGER DE LILLE 2024","You’re thinking of pursuing your studies after a bac +3 and wondering what are the differences between a master, a mastère, an MSc or an MBA ? Find out more about the specific features of each of these degrees and their career opportunities",Public,once a year,http://rencontres-de-l-etudiant-poursuite-d-etudes-et-masters-lille.salon.letudiant.fr/,promosalons@letudiant.fr,France,False,2024-03-15,2,1344
7464,VIVING SAINT-MALO 2024,"Saint-Malo Home Fair. Construction, renovation, promotion, financing, opening & closing, insulation, energy production, heating & air conditioning, decoration & furnishing, kitchen & bath, household art, exteriors, DIY",Public,once a year,http://www.viving.fr/saint-malo,contact@habitatexpo.fr,France,False,2024-03-15,3,1811
7465,SALON DE L'HABITAT DE CAEN 2024,Fair dedicated to the world of the garden and the house in Caen,Public,once a year,http://www.caen-evenements.com/agenda,info@caen-evenements.com,France,False,2024-03-15,3,1442
7466,CEREA BENESSERE 2024,"An event dedicated to holistic medicine, wellness and environmental sustainability, where we can find traditional remedies, novelties and best practices to take care of ourselves and our planet",Public,once a year,http://www.fieredelbenessere.it/visita-cerea-benessere,info@blunautilus.it,Italy,False,2024-03-16,2,1734
7467,FIERA DEL TEMPO LIBERO 2024,"Exhibition of Free Time, Entertainment and Life in the Open Air",Public,once a year,http://fieradeltempolibero.it/,commerciale@fieradeltempolibero.it,Italy,False,2024-03-15,3,1456
7468,"SALON DE L'APPRENTISSAGE, DE L'ALTERNANCE ET DES MÉTIERS DE GRENOBLE 2024","Exhibition of apprenticeship, work-study and trades",Public,once a year,http://salon-apprentissage-alternance-et-metiers-grenoble.salon.letudiant.fr/,info@letudiant.fr,France,False,2024-03-16,1,1468
7469,BRUSSELS DESIGN MARKET 2024,"The largest vintage objects fair in Europe. Brussels Design Market has more than 100 exhibitors from the Netherlands, Belgium, UK, Germany, Dannemark, Austria, Italy, where thousands of buyers come bargain hunting pieces from the earl 50s to the late 80s",Public,twice a year,http://designmarket.be/,info@designmarket.be,Belgium,False,2024-03-16,2,1892
7470,POLLICE VERDE - VICENZA 2024,"Exhibition and Market Exhibition dedicated to Garden, Kitchen Garden, Green Areas, Ecology",Public,once a year,http://multimediatre.it/index.php/calendario-fiere,info@polliceverdefiera.it,Italy,False,2024-03-15,3,1456
7471,HOLIDAY WORLD 2024,Central European Tourism Trade Fair,Public,once a year,http://www.holidayworld.cz/en.html,holidayworld@incheba.cz,Czech Republic,False,2024-03-15,3,1376
7472,MAISONMANIA 2024,Home & Renovation Show,Public,once a year,http://salon-maisonmania.com/,parcexpo@montpellier-events.com,France,False,2024-03-15,4,1486
7473,FOR CARAVAN 2024,Exhibition of Recreational Vehicles and Caravans,Public,once a year,http://forcaravan.cz/,gr@abf.cz,Czech Republic,False,2024-03-15,3,1376
7474,IDEAL HOME SHOW 2024,"International Home Show. Ideal Home Show has 7 dedicated show areas for all needs and tastes. Everything from ideal Interiors, to ideal Home Improvements, with ideal Gardens, ideal Gadgets, ideal Food & Housewares, ideal Shopping & ideal Woman",Public,once a year,http://www.idealhomeshow.co.uk/,richard@media-ten.com,UK - United Kingdom,False,2024-03-15,17,1435
7475,ESTUDIA - SALÓ DE L'ENSENYAMENT 2024,Educational and Vocational Guidance Show,Public,once a year,http://www.ensenyament.com/,info@firabarcelona.com,Spain,False,2024-03-15,5,1645
7476,FRANCHISE EXPO PARIS 2024,International Franchise Exhibition. Franchise Expo Paris is the international hub connecting investors from 83 countries with the most renowned franchisors looking to expand their concept worldwide,Public,once a year,http://www.franchiseparis.com/,info@franchiseparis.com,France,False,2024-03-16,3,1343
7477,TATTOO EXPO 2024,"Vicenza Tattoo Fair. More than 150 Italian and international tattoo artists, more than 50 events and entertainment of all kinds. Plenty of space also for products in the Tattoo sector",Public,once a year,http://multimediatre.it/index.php/calendario-fiere,info@multimediatre.com,Italy,False,2024-03-15,3,1456
7478,ID INFOTAGE DENTAL MÜNCHEN 2024,"German Dental Equipment Exhibition. Whether you are a dentist, dental technician or specialist - there is an interesting offer for every visitor",Public,once a year,http://www.infotage-dental.de/,central@messe-berlin.de,Germany,False,2024-03-15,2,1354
