id,event_name,description,audience,cycle,website,email,country,date_uncertain,date,duration_days,venue_id
4373,OHIO STATE FAIR 2024,"Ohio State Fair. Ohio State Fair celebrates Ohio’s products, its people and their accomplishments",Public,once a year,http://www.ohiostatefair.com/,info@expo.state.oh.us,USA,False,2024-07-24,12,751
4374,IOLA CAR SHOW & SWAP MEET 2024,One of America’s largest auto events,Public,once a year,http://www.iolaoldcarshow.com/,Information@iolaoldcarshow.com,USA,False,2024-07-11,3,1151
4375,GLOBAL TRAVEL MARKETPLACE 2024,"Travel Industry Trade Fair in Hollywod. GLOBAL TRAVEL MARKETPLACE features travel advisers from all over USA and restaurateur, Hotelier, resorts, tour companies, airlines, cruise lines, ancillary travel products & services from round the globe",Public,once a year,http://www.gtmflagship.com/,tbednarczyk@travelweekly.com,USA,False,2024-07-18,3,1152
4376,TOOL DEALER EXPO 2024,"Professional Automotive Tool Exhibition. Tool Dealer Expo features shop tools & equipment, air conditioning tools, Electric & diagnostic tools, Paint & Body Equipment Supplies, Tools Storage, Measurement tools, Welding Equipment",Public,once a year,http://exhpo.com/usa/isn-tool-dealer-expo,,USA,False,2024-07-12,2,1153
4377,NBJ SUMMIT 2024,"Conference on Product Innovation and Successful Brand Management for the Health and Nutrition Industry. Nutracon helps companies develop new science-supported products in the supplements, functional foods and beverages, and nutricosmetics sectors",Public,once a year,http://nbjsummit.com/,tradeshows@newhope.com,USA,False,2024-07-29,4,1154
4378,BOEING SEAFAIR AIR SHOW 2024,Air Show. The Boeing Seafair Air Show is one of the most impressive air shows in the country,Public,once a year,http://www.seafair.org/airshow,info@seafair.com,USA,True,2024-08-01,1,1155
4379,PALO ALTO CLAY AND GLASS FESTIVAL 2024,"Annual Clay and Glass Fine Arts Fair in California. PALO ALTO CLAY & GLASS FESTIVAL features fine art work, sculptures, handycrafts with clay and glass, paintings, ceramics, pottery, abstract jewelry, Show pieces, clay toys, glass lamp shade",Public,once a year,http://www.acga.net/,jan_schachter@sbcglobal.net,USA,False,2024-07-13,2,1156
4380,INTERNATIONAL FOLK ART MARKET 2024,"Folk Art Festival in Santa Fe. INTERNATIONAL FOLK ART MARKET is an open air art show that features textiles, handmade jewelry, beadwork, unique ceramics designs, pottery, handwoven baskets, homegoods, paintings from folk life, folk dance & music...",Public,once a year,http://folkartmarket.org/for-artists/application-guide,askus@folkartalliance.org,USA,False,2024-07-11,4,1157
4381,COFFEE FEST - ANAHEIM 2024,Coffee Fest attracts the top-selling brands in the specialty coffee industry and beyond. Coffee Fest Anaheim is along-side the Western Foodservice & Restaurant Expo,Public,once a year,http://www.coffeefest.com/anaheim,info@coffeefest.com,USA,True,2024-08-01,1,803
4561,TOP FLOTILLAS 2024,"Top Flotillas stimulates business creation and strategic links in the fleet industry: trucks, cars, buses",Public,once a year,http://www.topflotillas.com/,topflotillas@reedexpo.com,Mexico,False,2024-09-03,3,1201
4382,ANNUAL HADDONFIELD CRAFTS AND FINE ART FESTIVAL 2024,"Fine Arts and Craft Fair. ANNUAL HADDONFIELD CRAFTS AND FINE ART FESTIVAL features handicrafts, fine art, sculptures, paintings, woodwork, metal artwork, candles, textiles, creative jewelry, handmade household items and show pieces",Public,once a year,http://www.renaissancecraftables.com/,,USA,False,2024-07-13,2,1158
4383,AGROCHEMEX BRAZIL 2024,"Global Crop Protection Industry Trade Show. Research and development, Processing, laboratory / testing, labelling and packing, spraying",Public,once a year,http://www.aceshow.com/html/html/index.html,ccpia@126.com,Brazil,True,2024-08-01,1,1159
4384,FLORIDA SUPERCON 2024,"Three days packed full of anime, celebrities, gaming, comics, and pop culture",Public,once a year,http://www.floridasupercon.com/,FSCINFO@Reedpop.com,USA,False,2024-07-12,3,707
4385,HOME TEXTILES SOURCING EXPO 2024,"Home Textiles Sourcing provides manufacturers, retailers, jobbers, converters, contract specifiers, and designers a dedicated avenue to locate new fabrics and products for their latest home collections",Public,once a year,http://home-textiles-sourcing.us.messefrankfurt.com/new-york/en.html,jennifer.bacon@usa.messefrankfurt.com,USA,False,2024-07-16,3,551
4386,ANNUAL GUILFORD CRAFT EXPO 2024,"Art and craft fair. ANNUAL GUILFORD CRAFT EXPO is an open air juried show featuring fine arts, American handicraft, paintings, textile designs, creative jewelry, ceramics & pottery, sculptures and artwork in fiber, metal, leather, glass, wood, mixed medi",Public,once a year,http://guilfordartcenter.org/expo,,USA,False,2024-07-19,3,1160
4387,NATIONAL NURSE PRACTITIONER SYMPOSIUM & EXHIBITION 2024,"Expo and Workshops for Nurses, Midwives and Physician Assistants. NATIONAL NURSE PRACTITIONER SYMPOSIUM & EXHIBITION features healthcare organisations, clinical cosmetology, diagnostics, pharmaceuticals, nursing and health education institutes",Public,once a year,http://www.npsymposium.com/,info@milestoneshows.com,USA,False,2024-07-18,4,1161
4388,ESS+ 2024,"The ESS+ international security fair is one of the most important in Latin America, due to its technological content and the large influx of professionals & end users, looking for cutting-edge and sustainable solutions",Public,once a year,http://www.securityfaircolombia.com/,info@securityfaircolombia.com,Colombia,True,2024-08-01,1,424
4389,CONGRESSO FENABRAVE 2024,"FENABRAVE CONGRESS target public are owners, executives and professionals of dealerships of automotive vehicles of all segments (domestic and imported cars, trucks, buses and road implements, motorcycles, tractors and agricultural machinery)",Public,once a year,http://www.congresso-fenabrave.com.br/,atendimentovisitante@rxglobal.com,Brazil,True,2024-08-01,1,440
4390,INTERSECT ASPEN 2024,Art Fair ranging from 1950-present,Public,once a year,http://intersectaspen.com/,info@clarionevents.com,USA,False,2024-07-30,4,1162
4391,EDUTECHNIA 2024,Edutechnia is an exhibition platform specialized in solutions and technologies for education and knowledge transfer,Public,once a year,http://www.edutechnia.com/,info@corferias.com,Colombia,True,2024-08-01,1,424
4392,STAMP & SCRAPBOOK EXPO DULUTH 2024,"Art & Craft fair in Duluth, GA. STAMP & SCRAPBOOK EXPO DULUTH features craft show, craft shopping, paper craft, clay modelling, abstract arts, Art & Craft workshop, craft tools, creative ideas and crafts for kids",Public,once a year,http://www.scrapbookexpo.com/,Info@scrapbookexpo.com,USA,False,2024-07-19,2,518
4393,LIFEST OSHKOSH 2024,"Christian music festival in Wisconsin. LIFEST OSHKOSH features live band, Music CDs and artist merchandise",Public,once a year,http://lifest.com/oshkosh,info@lifepromotions.com,USA,False,2024-07-11,4,667
4562,NEWPORT BOAT SHOW 2024,The Newport International Boat Show encompasses historic Newport Harbor allowing you to enjoy everything the City-by-the-Sea has to offer while experiencing a full range of powerboats and sailboats from both domestic & international companies,Public,once a year,http://www.newportboatshow.com/,,USA,False,2024-09-12,4,1202
4563,WORLD FLORAL EXPO 2024,International Fresh Cut Flower Trade Show. World Floral Expo is a professional business event focusing on each and every buyer of fresh cut flowers,Public,once a year,http://hppexhibitions.com/wfe,info@hpp.nl,USA,True,2024-09-01,1,551
4564,FASTENER FAIR MEXICO 2024,International Exhibition for Fastener and Fixing Technology,Public,once a year,http://www.fastenerfairmexico.com/en-us.html,francisco.lopez@rxglobal.com,Mexico,False,2024-09-05,3,784
4565,CANADIAN APARTMENT INVESTMENT CONFERENCE 2024,Canadian Apartment Investment Conference. Facilitating connections and insights to strategize on housing affordability and overcome high costs and supply issues,Public,once a year,http://informaconnect.com/canadian-apartment-investment-conference/overview,events@informacanada.com,Canada,False,2024-09-11,1,585
4566,ATLANTIC CITY IN-WATER POWER BOAT SHOW 2024,"Boat Show in Atlantic City. ATLANTIC CITY IN-WATER POWER BOAT SHOW features Sport Cruisers, Express Yachts, Sport Fishing Yachts, Marine Electronics, Fishing Equipment & Supplies, Repair Facilities, nautical supplies, accessories & clothing...",Public,once a year,http://acinwaterboatshow.com/,,USA,False,2024-09-05,4,1203
4567,WIND TURBINE BLADE NORTH AMERICA 2024,"Forum dedicated to Wind Turbine Blade materials, design, manufacturing and maintenance: developing the local supply chain",Public,once a year,http://www.ami.international/events/upcoming,info@amiplastics.com,USA,True,2024-09-01,1,448
4568,POWDER & BULK SOLIDS TEXAS CONFERENCE '2024,The Powder & Bulk Solids Texas Conference is a two-day technical event focused on bringing vital education to engineers in the dry processing and bulk material handling industry,Public,unknown,http://www.powderbulksolids.com/,registration.advmfg@informa.com,USA,False,2024-09-10,2,1204
4569,MEXICO WINDPOWER 2024,Mexico WindPower is the premier wind energy event in Mexico showcasing the latest in innovations and technology for leading national and international decision makers,Public,once a year,http://www.mexicowindpower.com.mx/,DanielaM@amdee.org,Mexico,False,2024-09-03,3,438
4570,COMMERCIAL UAV EXPO AMERICAS 2024,"Commercial UAV Expo is a conference and exhibition focused on high-precision UAS for industrial use Surveying & Mapping; Civil Infrastructure; Process, Power & Utilities; Mining; Construction; Emergency Response & Search & Rescue (SAR); Agriculture...",Public,once a year,http://www.expouav.com/,info@expouav.com,USA,False,2024-09-03,3,775
4571,THE ULTIMATE WOMEN'S SHOW - DALLAS/FORTH WORTH 2024,"The Nation's Largest Women's Expos, combining the very best in shopping, speakers, makeovers and rejuvenation designed for the Ultimate Experience for women",Public,once a year,http://www.dfwwomensexpo.com/,info@ultimatewomensshow.com,USA,False,2024-09-07,2,976
4395,RDH UNDER ONE ROOF 2024,"Dental Suregery Expo & Conference. RDH Under One Roof will attract more than 1, 000 dental hygienists from across the country to an information-packed three-day event presented by RDH magazine",Public,once a year,http://www.rdhunderoneroof.com/,,USA,False,2024-07-18,3,1163
4396,PAACE AUTOMECHANIKA MEXICO 2024,"International Trade Exhibition in Latin America for Automotive OE, Aftermarket, Remanufacturing",Public,once a year,http://www.paaceautomechanika.com/,info@mexico.messefrankfurt.com,Mexico,False,2024-07-10,3,438
4397,SEATTLE ART FAIR 2024,"Contemporary Art Fair in Seattle. Seattle Art Fair is a one-of-a-kind showcase for the vibrant arts community of the Pacific Northwest, and a leading destination for the best in modern and contemporary art",Public,once a year,http://seattleartfair.com/,info@seattleartfair.com,USA,False,2024-07-25,4,560
4398,REFRI AMERICAS 2024,Caribbean and Latin American refrigeration/air conditioning industry expo and congress,Public,once a year,http://www.refriamericas.com/en,fgiraldo@refriamericas.com,USA,False,2024-07-24,2,938
4399,COLOMBBIA OIL & GAS 2024,Colombia Oil and Gas is an international Congress & exhibition bringing together flagship oil and gas companies from Latin America and world suppliers for the industry,Public,once a year,http://colombiaoilandgas.co/,events@vostockcapital.com,Colombia,False,2024-07-24,2,1164
4400,CONCRETE SHOW SOUTH AMERICA 2024,"Exhibition & Conference on Concrete Technology. Concrete Show SA showcases Concrete, Additives, waterproofing, sealants, accessories & tools, Light & heavy equipment manufacturers for construction & infra-structure & the concrete production chain",Public,every 2 years,http://www.concreteshow.com.br/,gilmara.santos@informa.com,Brazil,False,2024-08-06,3,440
4401,FESPA MEXICO 2024,"Wide format print exhibition. FESPA MEXICO is the event for the wide format print industry; providing an international platform to demonstrate & see the latest equipment & consumables in digital printing, screen printing, industrial & garment decoration",Public,once a year,http://www.fespa.com/en/events,info@fespa.com,Mexico,True,2024-08-01,1,438
4402,EXPOLAZER & OUTDOOR LIVING 2024,"International Swimming Pool, Spas, Leisure and Wellness Fair",Public,once a year,http://francalfeiras.com.br/calendario-de-eventos,atendimento@francal.com.br,Brazil,False,2024-08-13,4,1115
4403,MARKET ART + DESIGN BRIDGEHAMPTON 2024,Contemporary Art Fair in Bridgehampton,Public,once a year,http://www.artmarkethamptons.com/,info@amp.events,USA,True,2024-08-01,1,1165
4404,PET SOUTH AMERICA 2024,"Features in Accessories, Food, the Healthcare and Well-being of Small Animals",Public,once a year,http://www.petsa.com.br/,petsa@nm-brasil.com.br,Brazil,False,2024-08-14,3,440
4405,VINO FEST 2024,"Wine, Cheese and Ham Fair. VINOFEST is a specialized event in which the main players in the Bolivian and World Wine Sector participate, through Wineries and Companies",Public,once a year,http://www.feicobol.com.bo/,feicobol@feicobol.com.bo,Bolivia,True,2024-08-01,1,578
4406,EXPO MERCERÍA Y MANUALIDADES - GUADALAJARA 2024,Trade Show for Handicrafts Professionals from Mexico,Public,once a year,http://www.expomanualidades.info/guadalajara,info@expomanualidades.info,Mexico,True,2024-08-01,1,784
4407,EXPO CONSTRUÇÕES 2024,Brazilian Contruction fair,Public,every 2 years,http://www.expoconstrucoes.com.br/,info@veronafiere.it,Brazil,True,2024-08-01,1,814
4408,MEC SHOW 2024,"Metalmechanic, Energy and Automation Fair",Public,once a year,http://www.mecshow.com.br/,info@mecshow.com.br,Brazil,False,2024-08-06,3,814
4409,VANCOUVER WINE & JAZZ FESTIVAL 2024,International Wine & Jazz Festival. Wine & Jazz Festival also provides Commercial Exhibitor space for local and regional small businesses to market and sell your products and services,Public,once a year,http://www.vancouverwinejazz.com/,info@vancouverwinejazz.com,USA,True,2024-08-01,1,1166
4410,EMBALA NORDESTE 2024,"Trad show exclusively dedicated to the packaging, plastic and printing industries in the North and Northeast regions of Brazil",Public,every 2 years,http://embalane.com.br/,comercial@embalane.com.br,Brazil,False,2024-08-06,2,443
4411,INTEGRATEC MEXICO 2024,"Latin American exhibition & conference for Audiovisual Systems, Home Automation, Digital Signage and Unified Communications",Public,once a year,http://www.integratec.show/en,vmarin@integratec.show,Mexico,False,2024-08-14,2,1071
4412,SILVEREXPO - CALI 2024,Silverexpo is the only fair in Colombia aimed at seniors with their families and companions,Public,once a year,http://feriasilverexpo.com/,info@corferias.com,Colombia,True,2024-08-01,1,1167
4413,MINNESOTA FARMFEST 2024,Regional Farm Festival & Trade Exhibition in Minnesota,Public,once a year,http://www.ideaggroup.com/farmfest,IDEAg@IDEAgGroup.com,USA,False,2024-08-06,3,1168
4414,TECNO MUEBLE INTERNACIONAL 2024,"The business platform that connects the leading suppliers of machinery, raw materials and accessories with companies of furniture manufacturing, woodworking, and wood processing",Public,once a year,http://tecnomueble.com.mx/en,tecnomueble@afamjal.com.mx,Mexico,False,2024-08-14,4,784
4415,TELCEL GAMERGY 2024,E-sports & Gaming Festival,Public,once a year,http://www.ifema.es/gamergy/mexico,atencionalcliente@ifema.es,Mexico,True,2024-08-01,1,1104
4416,EXPO ALIMENTA 2024,"EXPO ALIMENTA presents the most complete showcase of national and international launches of Food, Beverages and related products in Bolivia, promoting an ideal space to do business for the future",Public,once a year,http://www.feicobol.com.bo/,feicobol@feicobol.com.bo,Bolivia,True,2024-08-01,1,578
4417,BLACK HAT USA 2024,Black Hat Briefings is a 6 days computer security conference that brings together a variety of people interested in InfoSec (Information Security),Public,once a year,http://www.blackhat.com/,blackhatregistration@informa.com,USA,False,2024-08-03,6,620
4418,EXPOPET COLOMBIA 2024,Colombian International Pet Fair,Public,once a year,http://expopetcolombia.com/,info@corferias.com,Colombia,True,2024-08-01,1,424
4419,NEXTCAR 2024,"The NextCar show promotes the sale of used vehicles, responding to the growing market demand, with the support and confidence of the most recognized dealers",Public,once a year,http://www.nextcar.com.co/,info@corferias.com,Colombia,True,2024-08-01,1,424
4466,PAX WEST 2024,"PAX West is a celebration of gaming and gaming culture featuring thought a massive expo hall filled with the best publishers and studios, new game demos, musical performances, tournaments, and a community experience unlike any other",Public,once a year,http://west.paxsite.com/,questions@paxsite.com,USA,False,2024-08-30,4,845
4420,FI SOUTH AMERICA 2024,"International Food Ingredients Exhibition. Food ingredients South America attracts everyone in the food industry, directly or indirectly involved in the production of food, food products, nutraceuticals, dietary supplements natural foods & beverages",Public,once a year,http://www.figlobal.com/southamerica/en/home.html,bnogueira@ubmbrazil.com.br,Brazil,False,2024-08-06,3,440
4421,EUROPA GAMES - PHOENIX 2024,"Fitness, Bodybuilding & combat sports Expo. EUROPA GAMES PHOENIX showcases alongside the competitions a variety of health products related to sports such as Health foods, Workout supplements, Vitamins, Natural & Holistic products, Anti-aging products",Public,once a year,http://www.europaexpo.com/,BettyPariso@aol.com,USA,False,2024-08-03,1,1169
4422,EXPO LOGISTI-K '2024,International Exhibition on Logistics and Material Handling,Public,every 2 years,http://www.expologisti-k.com.ar/,logisti-k@expotrade.com.ar,Argentina,False,2024-08-13,3,523
4423,NORTHWEST ARKANSAS PARADE OF HOMES 2024,The Parade of Homes showcases and celebrates the great features and exciting new home projects that are available in the area,Public,once a year,http://www.nwaparadeofhomes.com/,info@nwabuilders.com,USA,True,2024-08-01,1,1170
4424,SUGOI FAN FEST 2024,"This fair promotes the exchange around manga, anime, Japanese and comic culture, showing the latest trends in the market",Public,once a year,http://www.feicobol.com.bo/,feicobol@feicobol.com.bo,Bolivia,True,2024-08-01,1,578
4425,GUN & KNIFE SHOW ANOKA 2024,"Arms & Ammunition fair. GUN & KNIFE SHOW ANOKA showcases shooting rifles, all sizes of knives, swords, hunting shotgun, camouflage merchandise, fishing accessories, carbines, cartridges, Hi-tech optics, combat training and outdoor survival gear",Public,once a year,http://www.crocodileproductionsinc.com/,crocodile1@comcast.net,USA,True,2024-08-01,1,1171
4426,INTERPLAST 2024,Trade Fair and Congress of Plastic Technology Integration,Public,every 2 years,http://www.interplast.com.br/,feiras@messebrasil.com.br,Brazil,False,2024-08-13,4,425
4427,ESTILO CARIBE 2024,"Estilo Caribe is consolidated in the city of Barranquilla as the main beauty and health fair in the Caribbean region, bringing together the best brands at regional, national and international level",Public,once a year,http://www.estilocaribe.co/,info@corferias.com,Colombia,True,2024-08-01,1,609
4428,FRUITTRADE 2024,Chilean Business Round Table - Fruits & Vegetables for Export,Public,once a year,http://fruittrade.cl/,info@fedefruta.cl,Chile,True,2024-08-01,1,529
4429,EUROMOLD BRASIL 2024,"World Fair for Mold Making and Tooling, Design and Application Development",Public,every 2 years,http://www.messebrasil.com.br/,feiras@messebrasil.com.br,Brazil,True,2024-08-01,1,425
4430,SABOR BARRANQUILLA 2024,"Sabor Barranquilla is a gastronomic space that highlights the culinary values &#8203;&#8203; of the Caribbean and, through its largest exhibitors, offers the variety of flavors found in this Colombian region and abroad",Public,once a year,http://saborbarranquilla.com/,info@corferias.com,Colombia,True,2024-08-01,1,609
4431,ROCK ‘N’ ROLL SALT LAKE CITY 2024,"The event offers 3 distances, Marathon, Half Marathon and 10K, so that everyone can enjoy the biggest running party in the country",Public,once a year,http://www.runrocknroll.com/salt-lake-city,exposales@runrocknroll.com,USA,True,2024-08-01,1,605
4432,EXPO TRANSPORTE ARGENTINA 2024,International Exhibition of Freight and Passenger Transport Technologies and Equipment,Public,every 2 years,http://www.expotransporte.com.ar/,transporte@expotrade.com.ar,Argentina,False,2024-08-13,3,523
4433,OKLAHOMA CITY RENOVATION & LANDSCAPING SHOW 2024,"This fair brings together homeowners and the area's most knowledgeable and experienced remodeling, building and landscaping experts. Professionals will be on hand to share their valuable knowledge and bring your ideas to life or inspire new ones!",Public,once a year,http://www.homeshowcenter.com/overview/oklahoma3,info@homeshowcenter.com,USA,False,2024-08-02,3,564
4434,TAKEOFF NORTH AMERICA 2024,TakeOff North America is an event designed specifically for the domestic air service development community within North America,Public,once a year,http://www.routesonline.com/,world@informa.com,USA,True,2024-08-01,1,1172
4435,STAMP & SCRAPBOOK EXPO SCHAUMBURG 2024,"Art & Craft fair in Illinois. STAMP & SCRAPBOOK EXPO SCHAUMBURG features craft show, craft shopping, paper craft, clay modelling, abstract arts, Art & Craft workshop, craft tools, creative ideas and crafts for kids",Public,once a year,http://www.scrapbookexpo.com/,Info@scrapbookexpo.com,USA,False,2024-08-09,2,1173
4436,FRANCAL ABLAC SHOW 2024,Brazil International Shoe and Accessories Fashion Fair,Public,once a year,http://francal.com.br/home-ing,atendimento@francal.com.br,Brazil,True,2024-08-01,1,451
4437,"PLEIN ART, LE SALON DES MÉTIERS D'ART DE QUÉBEC 2024","Plein Art is an outdoor sale-exhibit where you will find crafts of all sorts, including ceramics, glass, textiles, Jewelry and much more",Public,once a year,http://matieres.ca/,info@metiersdart.ca,Canada,True,2024-08-01,1,1174
4438,GRAN SALÓN INMOBILIARIO 2024,"The GRAN SALON INMOBILIARIO is the fair that presents the most complete offer of new and used projects, residential, offices, hotels, commercial premises, national industrial parks...",Public,once a year,http://www.gransaloninmobiliario.com/,info@corferias.com,Colombia,True,2024-08-01,1,424
4439,SMALL BUSINESS EXPO DENVER 2024,"Business Trade Show. Small Business Expo brings together thousands of business owners and decision-makers to network, attend business critical workshops, build new business relationships and shop from vendors that provide unique products & services",Public,once a year,http://www.thesmallbusinessexpo.com/city/denver-2,info@theshowproducers.com,USA,True,2024-08-01,1,664
4440,SILVEREXPO - BOGOTÁ 2024,Silverexpo is the only fair in Colombia aimed at seniors with their families and companions,Public,once a year,http://feriasilverexpo.com/,info@corferias.com,Colombia,True,2024-08-01,1,424
4441,GOODGUYS WEST COAST NATIONALS PLEASANTON 2024,"Finest Car Fair in California. GOODGUYS WEST COAST NATIONALS PLEASANTON features attractive hot rods, muscle automobiles, classic vehicles, vintage models, trucks, Tools & kits, Street machines, automotive, used cars, customized personal vehicles",Public,once a year,http://www.good-guys.com/,,USA,True,2024-08-01,1,1175
4442,NETCOM 2024,Networking & Telecom Exhibition and Congress,Public,once a year,http://www.arandanet.com.br/eventos,fsf@arandanet.com.br,Brazil,False,2024-08-05,3,451
4572,REALREIT 2024,Canada’s only Real Estate Industry Conference devoted exclusively to REITs (Real Estate Investment Trusts) and REOCs (Real Estate Operating Companies),Public,once a year,http://www.realestateforums.com/realreit/en/overview/overview.html,events@informacanada.com,Canada,False,2024-09-10,1,585
4443,EXPO FENABRAVE 2024,"FENABRAVE EXPO target public are owners, executives and professionals of dealerships of automotive vehicles of all segments (domestic and imported cars, trucks, buses and road implements, motorcycles, tractors and agricultural machinery)",Public,once a year,http://www.congresso-fenabrave.com.br/,atendimentovisitante@rxglobal.com,Brazil,True,2024-08-01,1,440
4444,FENASUCRO & AGROCANA 2024,International Trade Fair of the Sugar and Alcohol Industry - International Trade Fair - Business and Technology Trade Fair of Sugarcane Agriculture,Public,once a year,http://www.fenasucro.com.br/en-us.html,atendimentovisitante@rxglobal.com,Brazil,False,2024-08-13,4,1176
4445,LABACE 2024,Annual Latin American Business Aviation Conference & Exhibition,Public,once a year,http://labace.com.br/,abag@abag.org.br,Brazil,True,2024-08-01,1,1111
4446,FERIA INTERNACIONAL DE ANIMALES DE COMPAÑÍA 2024,International Pet Show,Public,once a year,http://expopetcolombia.com/,info@corferias.com,Colombia,True,2024-08-01,1,424
4447,FASTMARKETS FOREST PRODUCTS LATAM CONFERENCE 2024,"International Conference for Forest Products, Pulp, Paper and Packaging Industry in Latin America",Public,once a year,http://www.fastmarkets.com/our-events/forest-product-events,events@risi.com,Brazil,True,2024-08-01,1,979
4448,ANNUAL ROCKY MOUNTAIN CONFERENCE ON MAGNETIC RESONANCE 2024,Educational Expo and Workshop for young physicists in Colorado. ANNUAL ROCKY MOUNTAIN CONFERENCE ON MAGNETIC RESONANCE features new adaptations on spectroscopy with EPR and SSNMR along with presentations by various industrial manufacturers,Public,once a year,http://rockychem.com/,info@milestoneshows.com,USA,False,2024-08-04,5,1177
4449,INTERSOLAR SOUTH AMERICA 2024,India's International Exhibition & Conference for the Solar Industry. Intersolar is the world's largest solar technology trade fair and the number one meeting point for everyone in the solar industry,Public,once a year,http://www.intersolar.net.br/,info@intersolar.de,Brazil,False,2024-08-27,3,451
