id,event_name,description,audience,cycle,website,email,country,date_uncertain,date,duration_days,venue_id
3809,CHANNEL PARTNERS CONFERENCE & EXPO 2024,"Channel Partners Las Vegas is the gathering place for the technology services community. Each year thousands of agents, VARs, MSPs, integrators and service providers converge to share ideas and drive discussion",Public,once a year,http://www.channelpartnersconference.com/,headoffice@informa.com,USA,False,2024-03-11,4,864
3810,EXPOANTAD & ALIMENTARIA MEXICO 2024,International Food and Beverage Fair,Public,once a year,http://www.alimentariamexico.com/,alimentariamexico@alimentaria.com,Mexico,False,2024-03-12,3,784
3811,MADE IN MONTANA TRADESHOW FOR FOOD AND GIFTS 2024,"Fair of innovative products, artful creations, and tasty treats from Montana",Public,once a year,http://www.madeinmontanausa.com/Tradeshow,madeinmontana@mt.gov,USA,False,2024-03-08,2,949
3804,NEW YORK BUILD EXPO 2024,The leading construction & Design show in New York,Public,once a year,http://www.newyorkbuildexpo.com/,marketing@newyorkbuildexpo.com,USA,False,2024-03-06,2,551
3813,SAINT JOHN HOME SHOW 2024,Construction and renovation showcase. Features the leaders of the home building and renovation industries from all over southern New Brunswick and beyond,Public,once a year,http://www.saintjohnhomeshow.ca/,info@masterpromotions.ca,Canada,False,2024-03-08,3,951
3814,SPECS SHOW 2024,"SPECS Expo will bring together the best retailers and suppliers in the country. Be ready to learn, share ideas, develop business partnerships and find innovative solutions in the distribution sector",Public,once a year,http://www.specsshow.com/,mcronin@ensembleiq.com,USA,False,2024-03-10,3,795
3815,SALT LAKE TRIBUNE HOME + GARDEN SHOW 2024,"Home & Renovation Show. The best place to find fresh ideas and smart advice for remodelling, home improvement, redesign & more. Innovative Products and Hundreds of Experts all Under One Roof",Public,once a year,http://saltlaketribunehomeshow.com/,rosannah@marketplaceevents.com,USA,False,2024-03-08,3,446
3816,BRICKFAIR LEGO® FAN EXPO 2024,Event dedicated to all all LEGO® lovers!,Public,once a year,http://www.fredericksburgexpocenter.com/,events@fred-center.com,USA,False,2024-03-08,3,688
3817,INDIANA FLOWER + PATIO SHOW 2024,Indiana Flower and Patio Show. Search for Home and Garden experts for all your projects,Public,once a year,http://www.indianaflowerandpatioshow.com/,rosannah@marketplaceevents.com,USA,False,2024-03-09,9,587
3818,GUNS & KNIFE SHOW JEFFERSON 2024,"Arms and Ammunition fair. GUNS & KNIFE SHOW IN JEFFERSON presents all types of firearms, training, combat knives & swords, fishing gears, antique pistols, cartridges, hunting accessories, gun cases & safes, self protection weapons and outdoor equipment",Public,twice a year,http://www.gemcapitolshows.com/,tiamalle@aol.com,USA,False,2024-03-09,2,952
3819,AEROSPACE & DEFENSE SUPPLIER SUMMIT SEATTLE 2024,International Business Convention for the Aerospace & Defense industries,Public,every 2 years,http://www.seattle.bciaerospace.com/,angoie@advbe.com,USA,False,2024-03-12,3,845
3820,WORCESTER SPRING HOME SHOW 2024,"Providence, RI Home Show. If you’re planning on remodeling or renovating your home, this is the home improvement event you can’t afford to miss",Public,once a year,http://www.jenksproductions.com/event/worcester-spring-home-show,monica@jenksproductions.com,USA,False,2024-03-08,3,879
3821,SIAL AMERICA 2024,"International Food, Beverage, Wine and Spirits Exhibition for the Distribution Industry of North America. SIAL Canada is the International Food Expo which caters to North American food-industry professionals",Public,every 2 years,http://sialamerica.com/,Boakley@emeraldx.com,USA,False,2024-03-19,3,429
3822,FOX CITIES HOUSE & OUTDOOR LIVING SHOW 2024,Fox Cities House & Outdoor Living Show is a comprehensive and expansive home show that brings together homeowners and the area's top remodeling and building experts,Public,once a year,http://www.homeshowcenter.com/overview/FoxCitiesHome2,info@homeshowcenter.com,USA,False,2024-03-15,3,767
3823,CINE GEAR EXPO - NEW YORK 2024,"International event for professionals engaged in the film & entertainment technology industry. Cine Gear features exhibits, new product and service introductions, complimentary seminars led by industry leaders, and ample opportunity to network with peers",Public,once a year,http://www.cinegearexpo.com/ny-expo,info@cinegearexpo.com,USA,False,2024-03-14,3,953
3824,AMERICAN MANUFACTURING SUMMIT 2024,American Summit dedicated to plant floor operations and manufacturing strategy,Public,every 2 years,http://www.manusummit.com/,info@generisgp.com,USA,False,2024-03-19,2,954
3825,FEICAP 2024,"Industrial, Commercial and Agricultural Exhibition. Commerce, industry, services, agriculture, entertainment, culture and leisure",Public,every 2 years,http://www.feicap.com.br/,feicap@feicap.com.br,Brazil,False,2024-03-19,6,955
3826,SMALL BUSINESS EXPO MIAMI 2024,"Business Trade Show. Small Business Expo brings together thousands of business owners and decision-makers to network, attend business critical workshops, build new business relationships and shop from vendors that provide unique products & services",Public,once a year,http://www.thesmallbusinessexpo.com/,info@theshowproducers.com,USA,False,2024-03-14,1,938
3827,PEARL GUN SHOW 2024,"Guns & Knives show. PEARL GUN SHOW presents all types of firearms, knives, militaria of war, fishing gears, antique pistol, hunting accessories, muzzle loading, gun case & safes, self protection weapon, outdoor survival training and hi-tech optics",Public,twice a year,http://www.bigpopgunshows.com/services,bigpopfireworks@gmail.com,USA,False,2024-03-16,2,956
3828,GREATER CINCINNATI HOME EXPO 2024,This event serves the Greater Cincinnati area homeowner by bringing together the most knowledgeable remodeling and building experts in the community under one roof,Public,once a year,http://www.homeshowcenter.com/overview/cincinnati2,info@homeshowcenter.com,USA,False,2024-03-15,3,528
3829,TECNO EDIFICIOS - PANAMA 2024,Facility Management Congress & Expo for Latin America & The Caribbean,Public,once a year,http://www.tecnoedificios.com/en,scamacho@tecnoedificios.com,Panama,False,2024-03-14,2,957
3830,EDMONTON HOME + GARDEN SHOW 2024,Edmonton Home & Garden Show,Public,once a year,http://www.edmontonhomeshow.com/,alisonf@mpeshows.com,Canada,False,2024-03-21,4,598
3831,CHARLESTON REMODELING EXPO 2024,"Home Improvement Expo. The Charleston Remodeling Expo will connect you to the area’s leading remodelers, builders, and design professionals",Public,once a year,http://www.homeshowcenter.com/overview/charlestonhome2,info@homeshowcenter.com,USA,False,2024-03-15,3,794
3832,NIGHTCLUB & BAR - BEVERAGE AND FOOD SHOW 2024,International Nightclub & Bar/Beverage Retailer/Beverage & Food Convention and Trade Show,Public,once a year,http://www.ncbshow.com/,theshow@oxpub.com,USA,False,2024-03-18,3,429
3833,EDMONTON BOAT & SPORTSMEN'S SHOW 2024,Boat and Outdoor Trade Fair,Public,once a year,http://www.edmontonboatandsportshow.ca/,ltrendall@mpltd.ca,Canada,False,2024-03-14,4,598
3834,NATIONAL MONEY SHOW 2024,American Numismatics Fair,Public,once a year,http://www.money.org/NationalMoneyShow,ana@money.org,USA,False,2024-03-14,3,958
3835,REVESTIR - BRAZILIAN TILE AND STONE EXHIBITION 2024,"International Granite, Marble and Ornamental Stones Exhibition",Public,once a year,http://www.exporevestir.com.br/,eliana.cesario@nm-brasil.com.br,Brazil,False,2024-03-19,4,959
3836,QUÉBEC GOLF SHOW 2024,Golf Show in Québec,Public,once a year,http://www.canadiangolfexpo.ca/expo-golf-quebec,gchambers@ngcoa.ca,Canada,False,2024-03-15,2,960
4535,EXPOALUMINIO 2024,International Aluminum Exhibition,Public,every 2 years,http://www.expoaluminio.com.br/,info@expoaluminio.com.br,Brazil,True,2024-09-01,1,440
4053,CANADIAN HYDROGEN CONVENTION 2024,"Canadian Hydrogen Industry Convention. Hydrogen Production, Storage & Infrastructure",Public,once a year,http://www.hydrogenexpo.com/,customerservice@hydrogenexpo.com,Canada,False,2024-04-23,3,598
3837,INTERNATIONAL PIZZA EXPO 2024,"Trade Show for the Pizza Industry. International Pizza Expo is one of the largest pizza show in the the World for pizzeria owners, operators, managers, distributors and food brokers",Public,once a year,http://www.pizzaexpo.com/,boakley@pizzatoday.com,USA,False,2024-03-19,3,429
3838,THE FRANCHISE EXPO - MIAMI 2024,North America's Franchise & Business Opportunities Event. THE FRANCHISE EXPO showcases the fastest growing franchises & business opportunities with thousands of potential franchisees & business partners eager ready to invest,Public,once a year,http://www.franchiseshowinfo.com/miami-visitor,info@nationalevent.com,USA,False,2024-03-16,2,938
3839,ACCESS MBA - SANTIAGO 2024,ACCESS MBA is a communication campaign specifically designed to better inform prospective students of existing MBA opportunities. ACCESS MBA is a series of events organised around the world,Public,twice a year,http://www.accessmba.com/tour,coutat@advent-communication.net,Chile,False,2024-03-20,1,961
3840,VISION EXPO EAST 2024,International Vision Expo East is the pre-eminent fashion and medical eyecare event where eyecare professionals in the Americas gather to experience the energy and international style,Public,once a year,http://www.visionexpoeast.com/,inquiry@visionexpoeast.com,USA,False,2024-03-15,3,551
3841,TORONTO SPORTSMEN'S SHOW 2024,Outdoor Trade Fair,Public,once a year,http://www.torontosportshow.ca/,ssprague@mpltd.ca,Canada,False,2024-03-14,4,826
3842,SPRING HOME & GARDEN SHOW 2024,Southwestern Ontario's Biggest Home & Garden Show,Public,once a year,http://www.ontariohomeshows.com/,info@continuumevents.ca,Canada,False,2024-03-15,3,766
3843,CEATI HYDROPOWER CONFERENCE 2024,"Hydropower Industry International Conference. Hydro utilities and dam owners are searching for new and innovative ways to inspect, maintain, operate, and manage their systems",Public,once a year,http://www.ceati.com/,events@ceati.com,USA,False,2024-03-19,2,962
3844,WESTCHESTER SPRING HOME SHOW 2024,"Westchester, NY Home Show. If you’re planning on remodeling or renovating your home, this is the home improvement event you can’t afford to miss",Public,once a year,http://www.jenksproductions.com/event/westchester-spring-home-show,monica@jenksproductions.com,USA,False,2024-03-16,2,530
3845,EXPO PRODUCCIÓN 2024,"Expo Producción provides a vital, professional platform for manufacturers, brands, retailers and suppliers to connect, network and learn about the newest trends, products and innovations impacting the industry",Public,every 2 years,http://www.expoproduccion.mx/,jose.navarro@ejkrausetarsus.mx,Mexico,False,2024-03-13,3,438
3846,CLEANTEC SHOW AMERICAS - PANAMA 2024,"Expo and Congress for professionals in the areas of hygiene, cleaning and maintenance in Latin America",Public,once a year,http://www.cleantec.show/en,scamacho@cleantec.show,Panama,False,2024-03-14,2,957
3847,WORLD AGRI-TECH INNOVATION SUMMIT SAN FRANCISCO 2024,"World Agri-Tech San Francisco is an international conference, networking and deal-making event for agribusinesses, solution providers, entrepreneurs and investors",Public,once a year,http://worldagritechusa.com/,info@rethinkevents.com,USA,False,2024-03-12,2,963
3848,WORLD PETROCHEMICAL CONFERENCE 2024,World Petrochemical Conference & Workshops,Public,every 3 years,http://www.ihs.com/info/events/wpc/index.aspx,2014WPC@ihs.com,USA,False,2024-03-18,5,836
3849,EXPOAGRO AFUBRA 2024,"Agricultural Fair. Agricultural machinery, equipment and tools, demonstrative crops, agricultural inputs, animal shows, forums, lectures and technical meetings, agro-industries. renewable energies...",Public,once a year,http://afubra.com.br/expoagro.html,expoagro@afubra.com.br,Brazil,False,2024-03-19,4,964
3850,ROUTES AMERICAS 2024,"Routes Americas will bring together airlines, airports and aviation stakeholders from across the world to build air services and global economic growth",Public,once a year,http://www.routesonline.com/,world@informa.com,Colombia,False,2024-03-19,3,965
3851,ANDINA LINK 2024,"Andina Link is the great International Fair of Telecommunications and Convergent Technologies, positioned as the preferred place for negotiations and networking of the industry in Latin America",Public,once a year,http://cartagena.andinalink.com/,maria@andinalink.com,Colombia,False,2024-03-18,4,966
3852,FESPA BRASIL 2024,"Wide format print exhibition. FESPA BRASIL is the event for the wide format print industry; providing an international platform to demonstrate & see the latest equipment & consumables in digital printing, screen printing, industrial & garment decoration",Public,every 2 years,http://www.fespabrasil.com.br/,info@fespa.com,Brazil,False,2024-03-18,4,451
3853,CINCINNATI AUTO EXPO 2024,"The Cincinnati Auto Expo continues its reign as the city’s premier retail automotive industry event by showcasing the features and technology in new crossovers, EVs, hybrids, sedans, sports cars, SUVs, trucks and more from your favorite manufacturers",Public,once a year,http://www.cincinnatiautoexpo.com/,info@gcada.net,USA,False,2024-03-14,4,562
3854,SINGLE-SERVE CAPSULES NORTH AMERICA 2024,Congress dedicated to Single-Serve Capsules. Identifying opportunities and overcoming obstacles,Public,once a year,http://www.ami.international/events/upcoming,consult@amiplastics-na.com,USA,False,2024-03-19,2,967
3855,HOME IMPROVEMENT & DESIGN EXPO - MAPLE GROVE 2024,"Home Improvement & Design Show. Home Improvement & Design Expo MAPLE GROVE is for decorators, builders, remodelers, designers, suppliers and other professionals with expertise in the home improvement and design industry",Public,once a year,http://minnesotahomeshows.com/show-schedule,contact@minnesotahomeshows.com,USA,False,2024-03-16,1,968
3856,EFN - EXPO FRANQUIAS NORDESTE 2024,Official Franchise Fair for North and Northeast Brazil,Public,once a year,http://expofranquiasne.com.br/,contato@insightconecta.com.br,Brazil,False,2024-03-20,3,969
3857,TORONTO COMICON 2024,International Comics Exhibition in Toronto,Public,once a year,http://comicontoronto.com/,info@fanexpohq.com,Canada,False,2024-03-15,3,585
3858,ACCESS MBA - LIMA 2024,ACCESS MBA is a communication campaign specifically designed to better inform prospective students of existing MBA opportunities. ACCESS MBA is a series of events organised around the world,Public,twice a year,http://www.accessmba.com/tour,coutat@advent-communication.net,Peru,False,2024-03-16,1,970
3881,ATLANTIC HEAVY EQUIPMENT SHOW 2024,"Trade show for equipment owners, operators and purchasers representing the fields of general construction, trucking, public works, utilities, aggregate production, road building and maintenance",Public,every 2 years,http://www.ahes.ca/,info@masterpromotions.ca,Canada,False,2024-03-27,2,945
3859,GUN & KNIFE SHOW HASTINGS 2024,"Self-defense weapon fair. GUN & KNIFE SHOW HASTINGS presents antique pistols, rifles, air guns, combat knives, gun magazines, rifle spoke, hunting gears, sharpening tools, holsters, gun safes, display cases, survival training and gun parts",Public,unknown,http://www.crocodileproductionsinc.com/,crocodile1@comcast.net,USA,False,2024-03-16,2,971
3860,ROCK ‘N’ ROLL WASHINGTON DC 2024,"The event offers 3 distances, Marathon, Half Marathon and 10K, so that everyone can enjoy the biggest running party in the country",Public,once a year,http://www.runrocknroll.com/washington-dc,exposales@runrocknroll.com,USA,False,2024-03-16,1,422
3861,AFFORDABLE ART FAIR - NEW YORK 2024,"International Art Exhibition. Affordable Art Fair is the leading showcase for affordable, contemporary original art from galleries and dealers",Public,twice a year,http://www.affordableartfair.com/fairs,enquiries@affordableartfair.com,USA,False,2024-03-21,4,869
3862,RE+ NORTHERN CALIFORNIA 2024,RE+ Northern California attracts energy professionals from across the solar and storage markets each year to facilitate business and connections,Public,once a year,http://re-plus.events/norcal,customerservice@re-plus.com,USA,False,2024-03-12,2,591
3863,AQUA SUR 2024,"International Aquaculture exhibition, the largest of southern hemisphere",Public,every 2 years,http://www.aqua-sur.cl/,agarcia@fisa.cl,Chile,False,2024-03-19,3,972
3864,WEST BEND GUN SHOW 2024,"Guns & Knife Show. WEST BEND GUN SHOW features shooting rifles, combat knives and swords, rifle spoke, muzzle load, hunting accessories, holsters, outdoor survival gears and hi-tech optics",Public,unknown,http://gunshowtrader.com/gunshows/wisconsin-gun-shows,,USA,False,2024-03-15,3,973
3865,THE INSPIRED HOME SHOW 2024,"International Home + Housewares Show offers you the opportunity to see first-hand consumer lifestyle and product trends for all areas of the home, both inside and out, under one roof",Public,once a year,http://www.housewares.org/show/default,atiritilli@housewares.org,USA,False,2024-03-16,4,497
3866,PACK EXPO EAST 2024,"International Packaging Process Show. For end users and suppliers around the world, PACK EXPO EAST offers a quality professional experience and a wide range of packaging innovations for each vertical market",Public,every 2 years,http://www.packexpoeast.com/,info@pmmi.org,USA,False,2024-03-18,3,974
3867,LANSING HOME & GARDEN SHOW 2024,The strongest Home & Garden show in the Mid-Michigan area,Public,once a year,http://showspan.com/LHG,events@showspan.com,USA,False,2024-03-14,4,975
3868,FUTURE FOOD-TECH SAN FRANCISCO 2024,"Future Food-Tech San Francisco will bring together key figures from across the food industry, including investors, start-ups, technology companies and food and ingredients manufacturers",Public,once a year,http://futurefoodtechsf.com/,info@rethinkevents.com,USA,False,2024-03-14,2,963
3869,NATURAL PRODUCTS EXPO WEST 2024,"Natural, organic & healthy Industry Expo. Natural Products Expo West is the best place to see and sample the newest products and developments in the natural products industry",Public,once a year,http://www.expowest.com/,info@newhope.com,USA,False,2024-03-12,5,803
3870,THE OUTDOOR ADVENTURE SHOW - CALGARY 2024,"Show for outdoor and adventure enthusiasts. The Outdoors Show features products for Walking, hiking, mountaineering, camping, photography, canoeing, cycling, mountain biking & sailing. Great deals from retailers like new products, outdoor organisations",Public,once a year,http://www.outdooradventureshow.ca/calgary,info@nationalevent.com,Canada,False,2024-03-16,2,452
3871,OTTAWA HOME & GARDEN SHOW 2024,"Ottawa, ON Home & Garden Show. Innovative Products and Hundreds of Experts all Under One Roof",Public,once a year,http://ottawahomeshow.com/,rosannah@marketplaceevents.com,Canada,False,2024-03-21,4,769
3872,IMPRESSIONS EXPO - ATLANTIC CITY 2024,Decorated Apparel and Imprinted Sportswear Industry Trade Show,Public,once a year,http://impressionsexpo.com/atlanticcity,info@impressionsexpo.com,USA,False,2024-03-21,3,893
3873,STAMP & SCRAPBOOK EXPO IRVING 2024,"Art & Craft fair in Irving, TX. STAMP & SCRAPBOOK EXPO IRVING features craft show, craft shopping, paper craft, clay modelling, abstract arts, Art & Craft workshop, craft tools, creative ideas and crafts for kids",Public,once a year,http://www.scrapbookexpo.com/,Info@scrapbookexpo.com,USA,False,2024-03-22,2,976
3874,MADISON EASTER GUN SHOW 2024,"Arms Expo. MADISON EASTER GUN SHOW features automatic firearms, hunting knife, self defense weapons, handguns, gun magazine, cartridges, ear plugs, flashlights, sharpening tool, holsters, Indian artifacts, laser optics, gun parts and outdoor survival gea",Public,unknown,http://gunshowtrader.com/gunshows/wisconsin-gun-shows,,USA,False,2024-03-29,2,977
3875,NEW ENGLAND HOME SHOW - FOXBORO 2024,"Foxborough, MA Home Show",Public,once a year,http://homeshowfoxboro.com/,info@newenglandhomeshows.com,USA,False,2024-03-22,3,978
3876,LE SALON NATIONAL DE LA FEMME - MONTRÉAL 2024,"Women's Show. Shop ‘til you drop at over 300 exhibits and find everything from food and wine sampling, fashion shows, celebrity guests, free makeovers, health, wellness & beauty secrets, cooking demos, home renovation advice, travel ideas...",Public,once a year,http://www.nationalwomenshow.com/,info@nationalevent.com,Canada,False,2024-03-22,3,513
3877,HARRISBURG GUN & KNIFE SHOW 2024,"Arms and Ammunition Fair. HARRISBURG SUMMER GUN & KNIFE SHOW features rifles, handguns, shotguns, combat knives and swords, cartridges, collectibles, antique coins, hunting and fishing accessories, war relics, carbines and self protection items",Public,unknown,http://www.cegunshows.com/,info@showmastersgunshows.com,USA,False,2024-03-23,2,668
3878,JLC LIVE NORTHWEST 2024,Construction Show exclusively serving the residential sector in New England. Thousands of residential construction professionals from across New England come to JLC LIVE to perfect their skills and build their businesses,Public,once a year,http://www.jlclive.com/,rmcconnell@hanleywood.com,USA,False,2024-03-21,3,565
3879,THE NATIONAL WOMEN'S SHOW - MONTREAL 2024,"Women's Show. Shop ‘til you drop at over 300 exhibits and find everything from food and wine sampling, fashion shows, celebrity guests, free makeovers, health, wellness & beauty secrets, cooking demos, home renovation advice, travel ideas...",Public,once a year,http://www.nationalwomenshow.com/,info@nationalevent.com,Canada,False,2024-03-23,2,513
3880,MEDTRADE SPRING CONFERENCE & EXPO 2024,"Home Healthcare Industry Exhibition. The Medtrade Mission is to provide high quality and effective, sales, marketing, educational and networking opportunities for companies and professionals in the HME Industry",Public,once a year,http://www.medtradespring.com/,medtrade@experient-inc.com,USA,False,2024-03-26,3,693
4536,ISSA INTERCLEAN LATIN AMERICA 2024,"International Trade Fair for Industrial Cleaning, Maintenance and Building Services",Public,every 2 years,http://latam.issa.com/,latam@issa.com,Mexico,True,2024-09-01,1,1071
3882,ACCESS MBA - SÃO PAULO 2024,ACCESS MBA is a communication campaign specifically designed to better inform prospective students of existing MBA opportunities. ACCESS MBA is a series of events organised around the world,Public,twice a year,http://www.accessmba.com/tour,coutat@advent-communication.net,Brazil,False,2024-03-24,1,979
3883,SOUTHERN IDEAL HOME SHOW - GREENSBORO 2024,Building & Home Improvement Show + Garden show,Public,once a year,http://www.greensboroidealhomeshow.com/,rosannah@marketplaceevents.com,USA,False,2024-03-22,3,819
3884,"SALON DU PLEIN AIR, CHASSE, PÊCHE ET DU CAMPING DE QUÉBEC + SALON DU BATEAU DE QUÉBEC 2024","Quebec Hunting, Fishing & Camping Show. Quebec Boat Show",Public,once a year,http://qcohfs.mpltd.ca/,smurphy@mpltd.ca,Canada,False,2024-03-21,4,658
3885,MONCTON BOAT SHOW 2024,"Moncton Boat Show. Cruisers, bowriders, pontoons, fishing boats, personal watercraft, inflatables and so much more!",Public,once a year,http://www.monctonboatshow.ca/,info@masterpromotions.ca,Canada,False,2024-03-22,3,945
3886,IDEAL HOME SHOW CANADA 2024,"Atlantic Canada’s largest home show, featuring Nova Scotia’s construction and renovation leaders. Showcase for indoor and outdoor living",Public,once a year,http://www.springideal.ca/,info@masterpromotions.ca,Canada,False,2024-03-22,3,782
3887,PALM BEACH ART 2024,"Contemporary and Modern art fair in West Palm Beach. PALM BEACH ART features fine arts, emergent modern artwork, paintings, sculptures, design on fabrics, woodwork, photography, drawings, video art, curio and antiques",Public,once a year,http://www.artpbfair.com/,info@artpbfair.com,USA,False,2024-03-21,4,715
3888,EXPO CAFÉ & GOURMET 2024,"An exhibition that combines the best of Expo Café and Gourmet Show, the two events that mark the gastronomic trend in Mexico",Public,once a year,http://cafeygourmet.com/,info@tradex.com.mx,Mexico,False,2024-03-21,3,784
3889,"SALON MAISONS ET RÉNOVATION D'OTTAWA, 2024",Ottawa Home & Remodelling Trade Show,Public,once a year,http://ottawahomeshow.com/,info@expomediainc.com,Canada,False,2024-03-21,4,769
3890,NB SPORTSMEN SHOW 2024,Boat and Outdoor Trade Fair,Public,once a year,http://www.nbsportsmenshow.ca/,info@masterpromotions.ca,Canada,False,2024-03-22,3,945
3891,DESALINATION LATIN AMERICA 2024,"International investment conference and exhibition for developing effective strategies, sharing experiences, presenting new investment projects and innovations to implement desalination projects and to increase water supplies all over Latin America",Public,once a year,http://desalinationlatinamerica.com/,events@vostockcapital.com,Chile,False,2024-03-26,2,961
3892,JLC LIVE NEW ENGLAND 2024,Residential Construction Show & conference exclusively serving the residential sector in New England. JLC LIVE attracts thousands of residential construction professionals from New England come to JLC LIVE to perfect their skills & build their businesses,Public,once a year,http://www.jlclive.com/en/home.html,tami.svarfvar@informa.com,USA,False,2024-03-21,3,565
3893,SPRING IDEAL HOME SHOW 2024,Home Show,Public,once a year,http://www.springideal.ca/,info@masterpromotions.ca,Canada,False,2024-03-22,3,782
3894,SPIE SMART STRUCTURES / NON-DESTRUCTIVE EVALUATION 2024,"SPIE Smart Structures/NDE is a leading conference on the applied technologies of advanced materials, smart sensor networks, and non-destructive evaluation tools",Public,once a year,http://spie.org/conferences-and-exhibitions/smart-structures/nde,customerservice@spie.org,USA,False,2024-03-24,5,980
3895,NATIONAL HARDWARE SHOW 2024,"Hardware, Houseware & Allied Products Expo",Public,once a year,http://www.nationalhardwareshow.com/,inquiry@hardware.reedexpo.com,USA,False,2024-03-26,3,429
